thai sentence,thai phoneme
ทำให้โรคฉี่หนูแพร่ระบาดไปหลายพื้นที่,tʰ a m h a3 j _ r oː3 k _ cʰ iː2 _ n uː5 _ pʰr ɛː3 r a4 b aː2 t _ p a j _ l aː5 j _ pʰ ɯː4 n tʰ iː3
กระสุนเจาะทะลุออกรักแร้ตัดขั้วหัวใจเป็นรูโหว่ตรวจสอบในรถพบ,kr a2 s u5 n _ c ᴐ2 _ tʰ a4 l u4 _ ʔ ᴐː2 k _ r a4 k r ɛː4 _ t a2 t _ kʰ uːa3 _ h uːa5 c a j _ p e n _ r uː _ w oː2 _ tr uːa2 t s ᴐː2 p _ n a j _ r o4 t _ pʰ o4 p
พบเอกสารขนาดเท่าบัตรประจำตัวประชาชนเป็นภาษาพม่าหนึ่งใบ,pʰ o4 p _ ʔ eː2 k k a2 s aː5 n _ kʰ a2 n aː2 t _ tʰ a3 w _ b a2 t pr a2 c a m t uːa pr a2 cʰ aː cʰ o n _ p e n _ pʰ aː s aː5 _ pʰ a4 m aː3 _ n ɯ2 ŋ _ b a j
เหยื่อแอนแทรกซ์,j ɯːa2 _ ʔ ɛː n _ tʰ a4 r ɛː3 k
เรสซามได้วางแผนระเบิดถล่มสนามบินก่อนจะมีการเฉลิมฉลองสหัสวรรษใหม่,r eː _ d aː3 j _ w aː ŋ pʰ ɛː5 n _ r a4 b ɤː2 t _ tʰ a2 l o2 m _ s a2 n aː5 m b i n _ k ᴐː2 n _ c a2 _ m iː _ k aː n _ cʰ a2 l ɤː5 m cʰ a2 l ᴐː5 ŋ _ s a2 h a2 t s a2 _ m a2 j
เพราะชิ้นส่วนเครื่องบินบริเวณห้องนักบินและประตูห้องผู้โดยสารมีรูโหว่คล้ายรูกระสุนปืนอย่างน้อย,pʰr ᴐ4 _ cʰ i4 n s uːa2 n _ kʰr ɯːa3 ŋ b i n _ b ᴐː r i4 w eː n _ h ᴐː3 ŋ _ n a4 k b i n _ l ɛ4 _ pr a2 t uː _ h ᴐː3 ŋ pʰ uː3 d oː j s aː5 n _ m iː _ r uː _ w oː2 _ kʰl aː4 j _ r uː _ kr a2 s u5 n p ɯː n _ j aː2 ŋ n ᴐː4 j
นางสาวซาอูทูฮ์เผลอตัวชมธรรมชาติของอันดามันใช้ไม้ปูเรือกระหน่ำฟาดลงบนร่างเหยื่อจนขาดใจตาย,n aː ŋ s aː5 w _ s aː _ ʔ uː _ tʰ uː _ pʰl ɤː5 t uːa _ cʰ o m _ tʰ a m m a4 cʰ aː3 t _ kʰ ᴐː5 ŋ _ ʔ a n d aː m a n _ cʰ a4 j _ m aː4 j _ p uː _ r ɯːa _ kr a2 n a2 m _ f aː3 t _ l o ŋ _ b o n _ r aː3 ŋ _ j ɯːa2 _ c o n _ kʰ aː2 t c a j t aː j
เพราะความดีไม่มีเสน่ห์สู้ความชั่วไม่ได้,pʰr ᴐ4 _ kʰw aː m d iː _ m a3 j _ m iː _ s a2 n eː2 _ s uː3 _ kʰw aː m cʰ uːa3 _ m a3 j d aː3 j
รับแจ้งเหตุยิงกันที่หน้าร้านเสริมสวยเกรซฟูล,r a4 p _ c ɛː3 ŋ h eː2 t _ j i ŋ _ k a n _ tʰ iː3 _ n aː3 r aː4 n _ s ɤː5 m s uːa5 j _ k eː n
พี่สาวนางถาวรเป็นช่างเสริมสวยของร้านเกรซฟูล,pʰ iː3 s aː5 w _ n aː ŋ _ tʰ aː5 w ᴐː n _ p e n _ cʰ a3 ŋ s ɤː5 m s uːa5 j _ kʰ ᴐː5 ŋ _ r aː4 n _ k eː n
ตอนเช้าจึงออกมาเอาปุ๋ยเพื่อหว่านต่อ,t ᴐː n cʰ a4 w _ c ɯ ŋ _ ʔ ᴐː2 k _ m aː _ ʔ a w _ p u5 j _ pʰ ɯːa3 _ w aː2 n _ t ᴐː2
คนร้ายคนแรกลงมือข่มขืนที่บริเวณหัวโต๊ะด้านใน,kʰ o n r aː4 j _ kʰ o n _ r ɛː3 k _ l o ŋ m ɯː _ kʰ o2 m kʰ ɯː5 n _ tʰ iː3 _ b ᴐː r i4 w eː n _ h uːa5 t o4 _ d aː3 n n a j
และสูญหายสิบสองรายส่วนเรื่องความช่วยหลือทางองค์กรเอ็มเอชดี,l ɛ4 _ s uː5 n h aː5 j _ s i2 p _ s ᴐː5 ŋ _ r aː j _ s uːa2 n _ r ɯːa3 ŋ _ kʰw aː m _ cʰ uːa3 j _ l ɯː5 _ tʰ aː ŋ _ ʔ o ŋ k ᴐː n _ ʔ e m _ ʔ eː2 t _ d iː
และแม้แต่เว็บของซอฟต์แวร์ปาร์ค,l ɛ4 _ m ɛː4 t ɛː2 _ w e4 p _ kʰ ᴐː5 ŋ _ s ᴐː3 p w ɛː _ p aː2 k
ขิ่นยุ้นต์ปลื้มได้เข้าเฝ้าในหลวง,n a4 j u4 n _ pl ɯː3 m _ d aː3 j _ kʰ a3 w f a3 w _ n a j l uːa5 ŋ
เห็ดหอมแช่น้ำหั่นเป็นเส้นเล็กเล็กเกี้ยมไฉ่ชนิดเปรี้ยวหั่นฝอย,h e2 t h ᴐː5 m _ cʰ ɛː3 n aː4 m _ h a2 n _ p e n _ s eː3 n _ l e4 k _ l e4 k _ k iːa3 m cʰ a2 j _ cʰ a4 n i4 t _ pr iːa3 w _ h a2 n _ f ᴐː5 j
ถั่วงอก,tʰ uːa2 ŋ ᴐː3 k
แอนดรูว์สที่ประทับมาตลอดปีที่แล้ว,ʔ ɛː n d a2 r uː _ s a2 tʰ iː3 _ pr a2 tʰ a4 p _ m aː _ t a2 l ᴐː2 t _ p iː _ tʰ iː3 l ɛː4 w
อาทิอู๋นวพลภูวดล,ʔ aː tʰ i4 _ ʔ uː5 _ n a4 w a4 _ pʰ o n _ pʰ uː w a4 d o n
ม็อบอึหมูเฮอึคนรอก่อน,m ᴐ4 p _ ʔ ɯ2 _ m uː5 _ h eː _ ʔ ɯ2 _ kʰ o n _ r ᴐː _ k ᴐː2 n
พาม็อบอึบุกทำเนียบรัฐบาล,pʰ aː _ m ᴐ4 p _ ʔ ɯ2 _ b u2 k _ tʰ a m n iːa3 p r a4 t tʰ a2 b aː n
ซึ่งรวมถึงเฟอร์กัสบอยด์,s ɯ3 ŋ _ r uːa m tʰ ɯ5 ŋ _ f ɤː _ k a2 t _ b ᴐː j
เรือเหาะแก๊สฮีเลียมไร้คน,r ɯːa h ᴐ2 _ k ɛː4 t _ h iː l iːa m _ r a4 j _ kʰ o n
เจาะกึ๋นสาวสาว,c ᴐ2 _ k ɯ5 n _ s aː5 w _ s aː5 w
ปลัดกรุงเทพมหานครทำพิลึกอีกอัดสื่อป้องเด็กหื่นไม่สนเด็กหญิงถูกขึงพืด,p a2 l a2 t _ kr u ŋ tʰ eː3 p m a4 h aː5 n a4 kʰ ᴐː n _ tʰ a m _ pʰ i4 l ɯ4 k _ ʔ iː2 k _ ʔ a2 t _ s ɯː2 _ p ᴐː3 ŋ _ d e2 k _ h ɯː2 n _ m a3 j _ s o5 n _ d e2 k j i5 ŋ _ tʰ uː2 k _ kʰ ɯ5 ŋ pʰ ɯː3 t
เวทีขาอ่อนมิสไทยแลนด์เวิลด์งวดเข้ามาทุกทีเหลือเวลาอีกราวหนึ่ง,w eː tʰ iː _ kʰ aː5 ʔ ᴐː2 n _ m i4 t _ tʰ a j l ɛː _ w ɤː n _ ŋ uːa3 t _ kʰ a3 w _ m aː _ tʰ u4 k tʰ iː _ l ɯːa5 _ w eː l aː _ ʔ iː2 k _ r aː w _ n ɯ2 ŋ
เหยื่อคดีอุ้มไปปรากฏตัวในเบอร์ด๊อกผับด้วย,j ɯːa2 _ kʰ a4 d iː _ ʔ u3 m _ p a j _ pr aː k o2 t t uːa _ n a j _ b ɤː _ d ᴐː4 k _ pʰ a2 p _ d uːa3 j
เซ็นทรัลพลาซา,s e n s a n _ pʰ a4 l aː s aː
จนเลอะเปรอะเปื้อน,c o n _ l ɤ4 _ pr ɤ2 p ɯːa3 n
ลูกสะใภ้เป็นคนดีและลูกชายก็ไม่ใช่คนฟุ้งเฟ้อเห่อเหิม,l uː3 k s a2 pʰ a4 j _ p e n _ kʰ o n _ d iː _ l ɛ4 _ l uː3 k cʰ aː j _ k ᴐː3 _ m a3 j cʰ a3 j _ kʰ o n _ f u4 ŋ f ɤː4 _ h ɤː2 h ɤː5 m
ส่วนแอ๋วรุจิรา,s uːa2 n _ ʔ ɛː5 w _ r u4 c i2 r aː
เนื่องจากขนเพชรเริ่มหงอกบ้างแล้ว,n ɯːa3 ŋ c aː2 k _ kʰ o5 n pʰ e4 t _ r ɤː3 m _ ŋ ᴐː2 k _ b aː3 ŋ _ l ɛː4 w
ก็ให้เสนอแขวนงบดังกล่าวไปเลย,k ᴐː3 _ h a3 j _ s a2 n ɤː5 _ kʰw ɛː5 n _ ŋ o4 p _ d a ŋ kl aː2 w _ p a j _ l ɤː j
สำหรับผู้ได้รับบาดเจ็บรักษาตัวที่โรงพยาบาลกล้วยน้ำไทสองประกอบด้วยนายสัญญามีสันเทียะ,s a5 m r a2 p _ pʰ uː3 _ d aː3 j r a4 p _ b aː2 t c e2 p _ r a4 k s aː5 t uːa _ tʰ iː3 _ r oː ŋ pʰ a4 j aː b aː n _ kl uːa3 j n aː4 m tʰ a j _ s ᴐː5 ŋ _ pr a2 k ᴐː2 p _ d uːa3 j _ n aː j _ s a5 n j aː _ m iː _ s a5 n _ tʰ ia3
ห้าแอฟริกาวันคริสต์มาสหนึ่งธันวาคม,h aː3 _ ʔ ɛː fr i4 k aː _ w a n kʰr i4 t m aː3 t _ n ɯ2 ŋ _ tʰ a n w aː kʰ o m
บ้านห้วยหมู่สิบเอ็ดตำบลบั่วหุ่ง,b aː3 n _ h uːa3 j _ m uː2 _ s i2 p _ ʔ e2 t _ t a m b o n _ b a2 w _ h u2 ŋ
พอตนเดินผ่านนายวิสุทธิ์พูดกับคนในสายเสียงดังให้ได้ยินเหมือนแขวะตนว่านั่นไงไอ้เหี้ยเป๋เดินผ่านมาแล้ว,pʰ ᴐː _ t o n _ d ɤː n pʰ aː2 n _ n aː j _ w i4 s u2 t _ pʰ uː3 t _ k a2 p _ kʰ o n n a j _ s aː5 j s iːa5 ŋ _ d a ŋ _ h a3 j _ d aː3 j j i n _ m ɯːa5 n _ kʰw ɛ2 _ t o n _ w aː3 _ n a3 n _ ŋ a j _ ʔ a3 j h iːa3 _ p eː5 _ d ɤː n pʰ aː2 n _ m aː _ l ɛː4 w
เตรคุพ,t eː
แถมเซ้วสูง,tʰ ɛː5 m _ s eː4 w _ s uː5 ŋ
เพราะเคยผ่านการเป็นพรีเซ็นเตอร์ในหนังโฆษณาเอฟเวอร์เซ้นส์โคโลญมาตั้งแต่อายุสิบเอ็ดขวบ,pʰr ᴐ4 _ kʰ ɤː j _ pʰ aː2 n _ k aː n _ p e n _ pʰr iː _ s e n t ɤː3 _ n a j _ n a5 ŋ _ kʰ oː s a2 n aː _ ʔ eː2 p _ w ɤː _ s eː4 n _ kʰ oː l oː n _ m aː _ t a3 ŋ t ɛː2 _ ʔ aː j u4 _ s i2 p _ ʔ e2 t _ kʰ uːa2 p
เพราะเห็นว่าอาชีพนี้มีเสน่ห์ตรงที่ได้แสดงบุคลิกเป็นของตัวเอง,pʰr ᴐ4 _ h e5 n _ w aː3 _ ʔ aː cʰ iː3 p _ n iː4 _ m iː _ s a2 n eː2 _ tr o ŋ tʰ iː3 _ d aː3 j _ s a2 d ɛː ŋ _ b u2 k kʰ a4 l i4 k _ p e n _ kʰ ᴐː5 ŋ _ t uːa ʔ eː ŋ
ชาวตำบลแม่เหียะต่างพูดเป็นเสียงเดียวกันว่าไม่เคยท่วมหนักเช่นนี้มาก่อน,cʰ aː w _ t a m b o n _ m ɛː3 _ h ia2 _ t aː2 ŋ _ pʰ uː3 t _ p e n _ s iːa5 ŋ _ d iːa w k a n _ w aː3 _ m a3 j _ kʰ ɤː j _ tʰ uːa3 m _ n a2 k _ cʰ eː3 n n iː4 _ m aː _ k ᴐː2 n
ปุ๋ยเฮิร์บ,p u5 j _ h ɤː3 p
ยาฉีดบำรุงเก้าหลอดเอกสารจำนวนหนึ่งและหนังสือเรียกค่าคุ้มครองของกลุ่มบีอาร์เอ็นหัวกระดาษเป็นรูปกวิชไขว้มีข้อความ,j aː cʰ iː2 t _ b a m r u ŋ _ k a3 w _ l ᴐː2 t _ ʔ eː2 k k a2 s aː5 n _ c a m n uːa n _ n ɯ2 ŋ _ l ɛ4 _ n a5 ŋ s ɯː5 _ r iːa3 k _ kʰ aː3 kʰ u4 m kʰr ᴐː ŋ _ kʰ ᴐː5 ŋ _ kl u2 m _ b iː _ ʔ aː _ ʔ e n _ h uːa5 _ kr a2 d aː2 t _ p e n _ r uː3 p _ k a2 w i2 t _ kʰw a3 j _ m iː _ kʰ ᴐː3 kʰw aː m
ข้อความเรียกค่าคุ้มครองปั๊มน้ำมันแห่งหนึ่งในจังหวัดยะลาจำนวนหนึ่งจุดห้าล้านบาทลงชื่อเปาะมะสุไหงบาตู,kʰ ᴐː3 kʰw aː m _ r iːa3 k _ kʰ aː3 kʰ u4 m kʰr ᴐː ŋ _ p a4 m n aː4 m m a n _ h ɛː2 ŋ _ n ɯ2 ŋ _ n a j _ c a ŋ w a2 t _ j a4 l aː _ c a m n uːa n _ n ɯ2 ŋ _ c u2 t _ h aː3 _ l aː4 n _ b aː2 t _ l o ŋ cʰ ɯː3 _ p ᴐ2 _ m a4 _ s u2 _ ŋ a5 j _ b aː _ t uː
ส่วนภาคเหนือปลอมครึ่งไม่ปลอมครึ่ง,s uːa2 n _ pʰ aː3 k n ɯːa5 _ pl ᴐː m _ kʰr ɯ3 ŋ _ m a3 j _ pl ᴐː m _ kʰr ɯ3 ŋ
ไทยลู้บเบสถาวร,tʰ a j _ l uː4 p _ b eː _ s a2 tʰ aː5 w ᴐː n
เดือดสื่อด่วนพิพากษา,d ɯːa2 t _ s ɯː2 _ d uːa2 n _ pʰ i4 pʰ aː3 k s aː5
สื่อนอกเกาะหนึบ,s ɯː2 _ n ᴐː3 k _ k ᴐ2 _ n ɯ2 p
ทะเลพัทยาหงอยคนผวาไอ้เข้งาบ,tʰ a4 l eː _ pʰ a4 t tʰ a4 j aː _ ŋ ᴐː5 j _ kʰ o n _ pʰ a2 w aː5 _ ʔ a3 j kʰ eː3 _ ŋ aː3 p
ส่งแอ๋เรียนราม,s o2 ŋ _ ʔ ɛː5 _ r iːa n _ r aː m
เรื่องที่มีการยักย้ายถ่ายเทเปลี่ยนถุงใหม่จากถุงของทางราชการที่แจกฟรีไปใส่ในถุงของร้านค้าปุ๋ย,r ɯːa3 ŋ _ tʰ iː3 _ m iː _ k aː n _ j a4 k j aː4 j tʰ aː2 j tʰ eː _ pl iːa2 n _ tʰ u5 ŋ _ m a2 j _ c aː2 k _ tʰ u5 ŋ _ kʰ ᴐː5 ŋ _ tʰ aː ŋ r aː3 t cʰ a4 k aː n _ tʰ iː3 _ c ɛː2 k _ fr iː _ p a j _ s a2 j _ n a j _ tʰ u5 ŋ _ kʰ ᴐː5 ŋ _ r aː4 n kʰ aː4 _ p u5 j
ปุ๋ยขายราคาถุงละหนึ่งร้อยบาทนั้นนายถิรวัฒน์ปฏิเสธที่จะให้การระบุแค่ว่าก่อนหน้านี้,p u5 j _ kʰ aː5 j _ r aː kʰ aː _ tʰ u5 ŋ _ l a4 _ n ɯ2 ŋ _ r ᴐː4 j _ b aː2 t _ n a4 n _ n aː j _ tʰ i2 r a4 _ w a4 t _ p a2 t i2 s eː2 t _ tʰ iː3 _ c a2 _ h a3 j k aː n _ r a4 b u2 _ kʰ ɛː3 _ w aː3 _ k ᴐː2 n n aː3 n iː4
ก่อนหน้านี้นายประดิษฐ์ก็เคยนำดินประมาณแปดร้อยถุงหรือสี่ตันมาฝากขายครั้งหนึ่งแล้ว,k ᴐː2 n n aː3 n iː4 _ n aː j _ pr a2 d i2 t _ k ᴐː3 _ kʰ ɤː j _ n a m _ d i n _ pr a2 m aː n _ p ɛː2 t _ r ᴐː4 j _ tʰ u5 ŋ _ r ɯː5 _ s iː2 _ t a n _ m aː _ f aː2 k kʰ aː5 j _ kʰr a4 ŋ n ɯ2 ŋ _ l ɛː4 w
แล้วครั้งนี้ที่ถูกจับเป็นครั้งที่สองโดยส่วนตัวแล้วไม่ทราบว่าเป็นดินที่ทางราชการนำมาแจกชาวบ้าน,l ɛː4 w _ kʰr a4 ŋ n iː4 _ tʰ iː3 _ tʰ uː2 k _ c a2 p p e n _ kʰr a4 ŋ _ tʰ iː3 _ s ᴐː5 ŋ _ d oː j _ s uːa2 n t uːa _ l ɛː4 w _ m a3 j _ s aː3 p _ w aː3 _ p e n _ d i n _ tʰ iː3 _ tʰ aː ŋ r aː3 t cʰ a4 k aː n _ n a m _ m aː _ c ɛː2 k _ cʰ aː w b aː3 n
ชาวบ้านคุมตัวผู้ต้องหาทั้งห้าคนส่งพันตำรวจตรีสุเกียรติ,cʰ aː w b aː3 n _ kʰ u m t uːa _ pʰ uː3 t ᴐː3 ŋ h aː5 _ tʰ a4 ŋ _ h aː3 _ kʰ o n _ s o2 ŋ _ pʰ a n t a m r uːa2 t tr iː _ s u2 _ k iːa2 t
ด้วยสมองที่ปราดเปรื่องพูดจาฉะฉานตรงไปตรงมาไร้จริตมารยา,d uːa3 j _ s a2 m ᴐː5 ŋ _ tʰ iː3 _ pr aː2 t pr ɯːa2 ŋ _ pʰ uː3 t c aː _ cʰ a2 cʰ aː5 n _ tr o ŋ p a j tr o ŋ m aː _ r a4 j _ c a2 r i2 t _ m aː n j aː
และไม่มีงานทำจึงชักชวนมารวมเป็นแก๊งแบ่งสายกันสายละสามถึงสี่คน,l ɛ4 _ m a3 j _ m iː _ ŋ aː n _ tʰ a m _ c ɯ ŋ _ cʰ a4 k cʰ uːa n _ m aː _ r uːa m _ p e n _ k ɛː4 ŋ _ b ɛː2 ŋ _ s aː5 j _ k a n _ s aː5 j _ l a4 _ s aː5 m _ tʰ ɯ5 ŋ _ s iː2 _ kʰ o n
คนออกตระเวนไปตามถนนหนทางในย่านชานเมืองเพื่อหาเหยื่อปล้นโทรศัพท์มือถือ,kʰ o n _ ʔ ᴐː2 k _ tr a2 w eː n _ p a j _ t aː m _ tʰ a2 n o5 n _ h o5 n tʰ aː ŋ _ n a j _ j aː3 n _ cʰ aː n m ɯːa ŋ _ pʰ ɯːa3 _ h aː5 _ j ɯːa2 _ pl o3 n _ tʰ oː r a4 s a2 p m ɯː tʰ ɯː5
เมื่อถูกจี้หรือปล้นจะส่งเสียงร้อง,m ɯːa3 _ tʰ uː2 k _ c iː3 _ r ɯː5 _ pl o3 n _ c a2 _ s o2 ŋ s iːa5 ŋ _ r ᴐː4 ŋ
โดยใช้เวลากว่าครึ่งชั่วโมงจึงสามารถช่วยเหลือออกมาได้,d oː j _ cʰ a4 j _ w eː l aː _ kw aː2 _ kʰr ɯ3 ŋ cʰ uːa3 m oː ŋ _ c ɯ ŋ _ s aː5 m aː3 t _ cʰ uːa3 j l ɯːa5 _ ʔ ᴐː2 k _ m aː _ d aː3 j
ได้ทราบชื่อนักท่องเที่ยวเคราะห์ร้ายภายหลังคือนายคีทอัมเตอร์ดรัมอายุสี่สิบสองปี,d aː3 j _ s aː3 p _ cʰ ɯː3 _ n a4 k tʰ ᴐː3 ŋ tʰ iːa3 w _ kʰr ᴐ4 r aː4 j _ pʰ aː j l a5 ŋ _ kʰ ɯː _ n aː j _ kʰ iː _ t ɤː3 _ d a2 r a m _ ʔ aː j u4 _ s iː2 _ s i2 p _ s ᴐː5 ŋ _ p iː
รวบแก๊งโจ๋ถล่มโหดคู่อริดับหนึ่งเจ็บอีกสอง,r uːa3 p _ k ɛː4 ŋ _ c oː5 _ tʰ a2 l o2 m _ h oː2 t _ kʰ uː3 ʔ a2 r i2 _ d a2 p _ n ɯ2 ŋ _ c e2 p _ ʔ iː2 k _ s ᴐː5 ŋ
หนังสือพิมพ์เดอะไทม์สรายงานเช่นกันโดยอ้างข้อมูลของหน่วยข่าวกรองในปากีสถานว่า,n a5 ŋ s ɯː5 pʰ i m _ d ɤ2 _ tʰ a j _ r aː j ŋ aː n _ cʰ eː3 n k a n _ d oː j _ ʔ aː3 ŋ _ kʰ ᴐː3 m uː n _ kʰ ᴐː5 ŋ _ n uːa2 j _ kʰ aː2 w kr ᴐː ŋ _ n a j _ p aː k iː s a2 tʰ aː5 n _ w aː3
พรีเมียร์ออยล์ระบุว่ายินดีที่จะปรับลดให้,pʰr iː m iːa _ ʔ ᴐː j _ r a4 b u2 _ w aː3 _ j i n d iː _ tʰ iː3 _ c a2 _ pr a2 p l o4 t _ h a3 j
เราทั้งคู่ปลื้มมาก,r a w _ tʰ a4 ŋ kʰ uː3 _ pl ɯː3 m _ m aː3 k
อูเครียนา,ʔ uː _ kʰr iːa _ n aː
ลีเยฟผู้ต้องสงสัย,l iː _ j eː3 p _ pʰ uː3 t ᴐː3 ŋ s o5 ŋ s a5 j
ทำโทษนักเรียนแบบไร้เหตุผลใช้เท้าเตะบ้างถีบบ้าง,tʰ a m tʰ oː3 t _ n a4 k r iːa n _ b ɛː2 p _ r a4 j _ h eː2 t pʰ o5 n _ cʰ a4 j _ tʰ aː4 w _ t e2 _ b aː3 ŋ _ tʰ iː2 p _ b aː3 ŋ
ปิณจีเสคิกุลตลอดเวลา,p i n _ c iː _ s eː5 _ kʰ i4 _ k u n _ t a2 l ᴐː2 t _ w eː l aː
ดักถล่มฆ่าประธานโคอ๊อปดับสยองข้างเบนซ์,d a2 k _ tʰ a2 l o2 m _ kʰ aː3 _ pr a2 tʰ aː n _ kʰ oː _ ʔ ᴐː4 p _ d a2 p _ s a2 j ᴐː5 ŋ _ kʰ aː3 ŋ _ b eː n
กับพวกที่ปั๊มน้ำมันคอสโมตำบลบ่อหรี่อำเภอฮอดจังหวัดเชียงใหม่,k a2 p _ pʰ uːa3 k _ tʰ iː3 _ p a4 m n aː4 m m a n _ kʰ ᴐː3 t _ m oː _ t a m b o n _ b ᴐː2 _ r iː2 _ ʔ a m pʰ ɤː _ h ᴐː3 t _ c a ŋ w a2 t _ cʰ iːa ŋ m a2 j
ในการซื้อขายหุ้นหรืออินไซเดอร์เทรดดิ้งในการสร้างราคา,n a j _ k aː n s ɯː4 kʰ aː5 j _ h u3 n _ r ɯː5 _ ʔ i n _ s a j _ d ɤː _ tʰr eː3 t _ d i3 ŋ _ n a j _ k aː n _ s aː3 ŋ _ r aː kʰ aː
พิธีที่จัดขึ้นครั้งนี้เพื่อเพิ่มความเข้มขลังให้แก่น้ำพระพุทธมนต์ที่นำมาจากห้าร้อยสี่สิบห้าวัดทั่วประเทศ,pʰ i4 tʰ iː _ tʰ iː3 _ c a2 t _ kʰ ɯ3 n _ kʰr a4 ŋ n iː4 _ pʰ ɯːa3 _ pʰ ɤː3 m _ kʰw aː m _ kʰ eː3 m _ kʰl a5 ŋ _ h a3 j _ k ɛː2 _ n aː4 m pʰr a4 pʰ u4 t tʰ a4 m o n _ tʰ iː3 _ n a m _ m aː _ c aː2 k _ h aː3 _ r ᴐː4 j _ s iː2 _ s i2 p _ h aː3 _ w a4 t _ tʰ uːa3 _ pr a2 tʰ eː3 t
สาวเตร็ดเตร่ค้าประเวณีริมคลองหลอด,s aː5 w _ tr e2 t tr eː2 _ kʰ aː4 pr a2 w eː n iː _ r i m _ kʰl ᴐː ŋ _ l ᴐː2 t
แต่ก็ยังมีการพูดจาแขวะกันตลอดก่อนเกิดเหตุระทึกขวัญ,t ɛː2 _ k ᴐː3 _ j a ŋ _ m iː _ k aː n _ pʰ uː3 t c aː _ kʰw ɛ2 _ k a n _ t a2 l ᴐː2 t _ k ᴐː2 n _ k ɤː2 t h eː2 t _ r a4 tʰ ɯ4 k kʰw a5 n
บ้านเดิมอยู่เลขที่แปดสิบเจ็ดหมู่สองตำบลเหล่าพรวนอำเภอเมืองจังหวัดอำนาจเจริญ,b aː3 n _ d ɤː m _ j uː2 _ l eː3 k tʰ iː3 _ p ɛː2 t _ s i2 p _ c e2 t _ m uː2 _ s ᴐː5 ŋ _ t a m b o n _ l a2 w _ pʰr uːa n _ ʔ a m pʰ ɤː _ m ɯːa ŋ _ c a ŋ w a2 t _ ʔ a m n aː3 t c a2 r ɤː n
นำโดยนายเวาะลันเป็นหัวหน้าชุดพร้อมอาวุธสงครามครบมือ,n a m _ d oː j _ n aː j _ w ᴐ4 _ l a n _ p e n _ h uːa5 n aː3 _ cʰ u4 t _ pʰr ᴐː4 m _ ʔ aː w u4 t _ s o5 ŋ kʰr aː m _ kʰr o4 p m ɯː
สวนยางพาราดังกล่าวเป็นของนางสาวสมพิศสัมภาวนะหรือเจ๊จู,s uːa5 n _ j aː ŋ pʰ aː r aː _ d a ŋ kl aː2 w _ p e n _ kʰ ᴐː5 ŋ _ n aː ŋ s aː5 w _ s o5 m _ pʰ i4 t _ s a5 m _ pʰ aː _ w a4 n a4 _ r ɯː5 _ c eː4 _ c uː
นายประพัฒน์ปัญญาชาติรักษ์หรือประพัฒน์แซ่ฉั่วไอ้ก้านยาวสมัยสิบสี่ตุลาสิบหก,n aː j _ pr a2 _ pʰ a4 t _ p a n j aː _ cʰ aː3 t _ r a4 k _ r ɯː5 _ pr a2 _ pʰ a4 t _ s ɛː3 _ cʰ a2 w _ ʔ a3 j _ k aː3 n j aː w _ s a2 m a5 j _ s i2 p _ s iː2 _ t u2 l aː _ s i2 p _ h o2 k
ช่วงที่ช่างแอร์ซ่อมแอร์เสร็จ,cʰ uːa3 ŋ _ tʰ iː3 _ cʰ a3 ŋ _ ʔ ɛː _ s ᴐː3 m _ ʔ ɛː _ s e2 t
โดยหญิงสาวหนึ่งในสองอยู่ในสภาพอ่อนเปลี้ยเพลียแรง,d oː j _ j i5 ŋ s aː5 w _ n ɯ2 ŋ _ n a j _ s ᴐː5 ŋ _ j uː2 _ n a j _ s a2 pʰ aː3 p _ ʔ ᴐː2 n pl iːa3 pʰl iːa r ɛː ŋ
วอนกระทรวงศึกษาธิการอย่าขวางปฏิรูปทำกฏหมายสะดุด,w ᴐː n _ kr a2 s uːa ŋ s ɯ2 k s aː5 tʰ i4 k aː n _ j aː2 _ kʰw aː5 ŋ _ p a2 t i2 r uː3 p _ tʰ a m _ k o2 t m aː5 j _ s a2 d u2 t
ประตูฝั่งคนขับเปิดอ้าทิ้งไว้มีศพหญิงสาวทราบชื่อคือนางกันดาพลชัยหรือเจ๊ตุ่ม,pr a2 t uː _ f a2 ŋ _ kʰ o n kʰ a2 p _ p ɤː2 t ʔ aː3 _ tʰ i4 ŋ _ w a4 j _ m iː _ s o2 p _ j i5 ŋ s aː5 w _ s aː3 p _ cʰ ɯː3 _ kʰ ɯː _ n aː ŋ _ k a n _ d aː _ pʰ o n _ cʰ a j _ r ɯː5 _ c eː4 _ t u2 m
นายชวลิตมหาจันทร์สมาชิกสภาผู้แทนราษฎรชัยภูมิเตรียมกระจับป้องกันเตะผ่าหมาก,n aː j _ cʰ a4 w a4 l i4 t _ m a4 h aː5 _ c a n _ s a2 m aː cʰ i4 k s a2 pʰ aː pʰ uː3 tʰ ɛː n r aː3 t s a2 d ᴐː n _ cʰ a j j a4 pʰ uː m _ tr iːa m _ kr a2 c a2 p _ p ᴐː3 ŋ k a n _ t e2 _ pʰ aː2 m aː2 k
ปลากระแหปลาตะเพียนทองปลาม้าปลาตะพากปลายี่สกปลาเนื้ออ่อน,pl aː kr a2 h ɛː5 _ pl aː t a2 pʰ iːa n tʰ ᴐː ŋ _ pl aː m aː4 _ pl aː t a2 pʰ aː3 k _ pl aː j iː3 s o2 k _ pl aː n ɯːa4 ʔ ᴐː2 n
แคล้วคลาดภยันตรายต่างต่างและเรื่องราวของโป่งข่ามเงียบหายไปนาน,kʰl ɛː4 w kʰl aː3 t _ pʰ a4 j a n t a2 r aː j _ t aː2 ŋ _ t aː2 ŋ _ l ɛ4 _ r ɯːa3 ŋ r aː w _ kʰ ᴐː5 ŋ _ p oː2 ŋ kʰ aː2 m _ ŋ iːa3 p _ h aː5 j _ p a j _ n aː n
และไม่มีชื่ออยู่ในโผฮั้วประมูลถนนทั้งเจ็ดสายทำให้นางจีราพรรณ์,l ɛ4 _ m a3 j _ m iː cʰ ɯː3 _ j uː2 _ n a j _ pʰ oː5 _ h a4 w _ pr a2 m uː n _ tʰ a2 n o5 n _ tʰ a4 ŋ _ c e2 t _ s aː5 j _ tʰ a m h a3 j _ n aː ŋ _ c iː _ r aː _ pʰ a n
กฤษฎาสุโกศลแคลปป์หรือน้อยวงพรูชอบแต่งตัวแบบหลายคาแร็กเตอร์,kr i2 t s a2 d aː _ s u2 _ k oː s o5 n _ kʰl ɛː3 p _ r ɯː5 _ n ᴐː4 j _ w o ŋ _ pʰr uː _ cʰ ᴐː3 p _ t ɛː2 ŋ t uːa _ b ɛː2 p _ l aː5 j _ kʰ aː _ r ɛ4 k _ t ɤː3
พระธิดาองค์น้อยของมกุฎราชกุมารนารุฮิโตะกับเจ้าหญิงมาซาโกะแห่งญี่ปุ่น,pʰr a4 tʰ i4 d aː _ ʔ o ŋ _ n ᴐː4 j _ kʰ ᴐː5 ŋ _ m a4 k u2 t r aː3 t cʰ a4 k u2 m aː n _ n aː _ r u4 _ h i4 _ t o2 _ k a2 p _ c aː3 w j i5 ŋ _ m aː _ s aː _ k o2 _ h ɛː2 ŋ _ j iː3 p u2 n
