thai sentence,thai phoneme
ส่วนใหญ่เป็นผู้ขับขี่ที่ใช้โทรศัพท์มือถือบางครั้งเบรกรถอย่างไม่มีเหตุผล,s uːa2 n j a2 j _ p e n _ pʰ uː3 _ kʰ a2 p kʰ iː2 _ tʰ iː3 _ cʰ a4 j _ tʰ oː r a4 s a2 p m ɯː tʰ ɯː5 _ b aː ŋ kʰr a4 ŋ _ br eː2 k _ r o4 t _ j aː2 ŋ _ m a3 j _ m iː _ h eː2 t pʰ o5 n
แซ่อึ้งอายุห้าขวบออกมาหาซื้อกับข้าวเมื่อเห็นผู้สื่อข่าวเจ๊หมวยกล่าวอย่างอัดอั้นใจว่า,s ɛː3 _ ʔ ɯ3 ŋ _ ʔ aː j u4 _ h aː3 _ kʰ uːa2 p _ ʔ ᴐː2 k _ m aː _ h aː5 _ s ɯː4 _ k a2 p kʰ aː3 w _ m ɯːa3 _ h e5 n _ pʰ uː3 s ɯː2 kʰ aː2 w _ c eː4 _ m uːa5 j _ kl aː2 w _ j aː2 ŋ _ ʔ a2 t ʔ a3 n _ c a j _ w aː3
เพราะไทยออยล์ไม่มีเครดิตในขณะนั้นทราฟิกูร่าจึงขอให้การปิโตรเลียมแห่งประเทศไทยเป็นตัวกลาง,pʰr ᴐ4 _ tʰ a j _ ʔ ᴐː j _ m a3 j _ m iː _ kʰr eː d i2 t _ n a j kʰ a2 n a2 n a4 n _ tʰr aː _ f i4 _ k uː _ r aː3 _ c ɯ ŋ _ kʰ ᴐː5 h a3 j _ k aː n p i2 tr oː l iːa m h ɛː2 ŋ pr a2 tʰ eː3 t tʰ a j _ p e n _ t uːa kl aː ŋ
โดยเป็นผู้เอาแหวนไปขายซึ่งขณะนี้ก็ได้ให้ฝ่ายสืบสวนติดตามตัวเจ้าของร้านที่รับซื้อแหวนไปมาสอบปากคำเป็นพยาน,d oː j _ p e n _ pʰ uː3 _ ʔ a w _ w ɛː5 n _ p a j _ kʰ aː5 j _ s ɯ3 ŋ _ kʰ a2 n a2 n iː4 _ k ᴐː3 d aː3 j _ h a3 j _ f aː2 j _ s ɯː2 p s uːa5 n _ t i2 t t aː m _ t uːa _ c aː3 w kʰ ᴐː5 ŋ r aː4 n _ tʰ iː3 _ r a4 p s ɯː4 _ w ɛː5 n _ p a j m aː _ s ᴐː2 p p aː2 k kʰ a m _ p e n _ pʰ a4 j aː n
เข็มกลัดรูปหมีแพนด้าจากอีฟส์จูเวลรี่กระเป๋าจูดิธลีเบอร์รูปแพนด้าจากแฟรงค์จิวเวลรี่และอื่นอื่น,kʰ e5 m kl a2 t _ r uː3 p _ m iː5 pʰ ɛː n d aː3 _ c aː2 k _ ʔ iː2 p _ c uː _ w eː n _ r iː3 _ kr a2 p a5 w _ c uː _ d i2 t _ l iː _ b ɤː _ r uː3 p _ pʰ ɛː n d aː3 _ c aː2 k _ fr ɛː ŋ _ c i2 _ r iː3 _ l ɛ4 _ ʔ ɯː2 n _ ʔ ɯː2 n
เรื่องได้แก่ผลงานเรื่องลูกตาเทียมไฮดร๊อกซีอาปาไท้มีรูพรุนสังเคราะห์จากกระดูกเคลื่อนไหว,r ɯːa3 ŋ _ d aː3 j k ɛː2 _ pʰ o5 n ŋ aː n _ r ɯːa3 ŋ _ l uː3 k t aː _ tʰ iːa m _ h a j _ dr ᴐː4 k _ s iː _ ʔ aː _ p aː _ tʰ a4 j _ m iː _ r uː pʰr u n _ s a5 ŋ kʰr ᴐ4 _ c aː2 k _ kr a2 d uː2 k _ kʰl ɯːa3 n w a5 j
โดยนายขจรศักดิ์วงศ์ศักดิ์ถาวรประธานสมาคมแอร์คาร์โก้บิสสิเนสกล่าวว่า,d oː j _ n aː j _ kʰ a2 c ᴐː n _ s a2 k _ w o ŋ _ s a2 k _ tʰ aː5 w ᴐː n _ pr a2 tʰ aː n _ s a2 m aː kʰ o m _ ʔ ɛː _ kʰ aː _ k oː3 _ b i2 t _ s i2 _ n eː3 t _ kl aː2 w _ w aː3
แค้นพ่อค้าเขมรสาดอึฉี่ใส่ไทยสั่งด่วนปิดด่านขึ้นเขาพระวิหาร,kʰ ɛː4 n _ pʰ ᴐː3 kʰ aː4 _ kʰ a2 m eː5 n _ s aː5 _ cʰ iː2 _ s a2 j _ tʰ a j _ s a2 ŋ _ d uːa2 n _ p i2 t _ d aː2 n _ kʰ ɯ3 n _ kʰ a5 w _ pʰr a4 w i4 h aː5 n
โจรบีบไข่ปล้นแนวใหม่ชิงรถจักรยานยนต์,c oː n _ b iː2 p _ kʰ a2 j _ pl o3 n _ n ɛː w _ m a2 j _ cʰ i ŋ _ r o4 t c a2 k kr a2 j aː n j o n
เบนซ์หงาย,b eː n _ ŋ aː5 j
โจอี้บอยฉี่ม่วงโต้เสพยามั่วผับ,c oː _ ʔ iː3 _ b ᴐː j _ cʰ iː2 _ m uːa3 ŋ _ t oː3 _ s eː5 pʰ a4 j aː _ m uːa3 _ pʰ a2 p
เพราะก่อนหน้านี้เลขาส่วนตัวของนายเสนาะแจ้งว่านายเสนาะจะเปิดบ้านให้สื่อมวลชนสัมภาษณ์,pʰr ᴐ4 _ k ᴐː2 n n aː3 n iː4 _ l eː kʰ aː5 _ s uːa2 n t uːa _ kʰ ᴐː5 ŋ _ n aː j _ s a2 n ᴐ2 _ c ɛː3 ŋ _ w aː3 _ n aː j _ s a2 n ᴐ2 _ c a2 _ p ɤː2 t _ b aː3 n _ h a3 j _ s ɯː2 m uːa n cʰ o n _ s a5 m pʰ aː3 t
เมียท้องแก่โผล่ตัว,m iːa _ tʰ ᴐː4 ŋ k ɛː2 _ pʰl oː2 _ t uːa
ให้มีการส่งเสริมเด็กเล่นกีฬาลดละในสิ่งฟุ้งเฟ้อเลิกใช้ชีวิตแบบฉาบฉวยรวมไปถึงการมั่วยามั่วเพศ,h a3 j _ m iː _ k aː n _ s o2 ŋ s ɤː5 m _ d e2 k _ l eː3 n k iː l aː _ l o4 t l a4 _ n a j _ s i2 ŋ _ f u4 ŋ f ɤː4 _ l ɤː3 k cʰ a4 j _ cʰ iː w i4 t _ b ɛː2 p _ cʰ aː2 p cʰ uːa5 j _ r uːa m p a j tʰ ɯ5 ŋ _ k aː n _ m uːa3 _ j aː _ m uːa3 _ pʰ eː3 t
พบว่าชายคนดังกล่าวอยู่ในอาการมึนเมาอ้างว่าทะเลาะกับหญิงสาวนักเที่ยวโต๊ะข้างเคียงคนหนึ่ง,pʰ o4 p _ w aː3 _ cʰ aː j _ kʰ o n _ d a ŋ kl aː2 w _ j uː2 _ n a j _ ʔ aː k aː n _ m ɯ n m a w _ ʔ aː3 ŋ _ w aː3 _ tʰ a4 l ᴐ4 _ k a2 p _ j i5 ŋ s aː5 w _ n a4 k tʰ iːa3 w _ t o4 _ kʰ aː3 ŋ kʰ iːa ŋ _ kʰ o n _ n ɯ2 ŋ
ฤกษ์เข้าบ้านเจ้าสาวก็ห้าทุ่มไม่ได้ช้าหรอกผู้สื่อข่าวถามว่าตอนนี้,r ɤː3 k _ kʰ a3 w _ b aː3 n _ c aː3 w s aː5 w _ k ᴐː3 _ h aː3 _ tʰ u3 m _ m a3 j d aː3 j _ cʰ aː4 _ r ᴐː2 k _ pʰ uː3 s ɯː2 kʰ aː2 w _ tʰ aː5 m _ w aː3 _ t ᴐː n n iː4
น้องเก๋เจ้าสาวในชุดสีบานเย็นปักดิ้นทองก็ลงมาจากชั้นสองของบ้านเพื่อเข้าพิธีหมั้น,n ᴐː4 ŋ _ k eː5 _ c aː3 w s aː5 w _ n a j _ cʰ u4 t _ s iː5 _ b aː n j e n _ p a2 k _ d i3 n tʰ ᴐː ŋ _ k ᴐː3 _ l o ŋ _ m aː _ c aː2 k _ cʰ a4 n s ᴐː5 ŋ _ kʰ ᴐː5 ŋ _ b aː3 n _ pʰ ɯːa3 _ kʰ a3 w _ pʰ i4 tʰ iː _ m a3 n
ว่าที่เจ้าบ่าวรับประทานขนมบัวลอยหรือขนมอี๋ซึ่งเป็นประเพณีของชาวจีน,w aː3 tʰ iː3 _ c aː3 w b aː2 w _ r a4 p pr a2 tʰ aː n _ kʰ a2 n o5 m _ b uːa l ᴐː j _ r ɯː5 _ kʰ a2 n o5 m _ ʔ iː5 _ s ɯ3 ŋ _ p e n _ pr a2 pʰ eː n iː _ kʰ ᴐː5 ŋ _ cʰ aː w _ c iː n
ส่วนการจัดตั้งรัฐบาลใหม่ดูแลอัฟกานิสถานนั้นนายฟรานเซสเวนเดรลล์ผู้ช่วยทูตพิเศษนายลัคธาร์,s uːa2 n _ k aː n _ c a2 t t a3 ŋ _ r a4 t tʰ a2 b aː n _ m a2 j _ d uː l ɛː _ ʔ a4 f k aː n i4 s a2 tʰ aː5 n _ n a4 n _ n aː j _ fr aː n _ s eː _ s a2 w eː5 n _ dr eː n _ pʰ uː3 cʰ uːa3 j tʰ uː3 t _ pʰ i4 s eː2 t _ n aː j _ l a4 k _ tʰ aː
ซึ่งมีการเตรียมกล้องดูดาวสุดไฮเทคมาบริการให้ประชาชนส่องดูดาวฟรีตั้งแต่คืนวันที่สิบแปด,s ɯ3 ŋ _ m iː _ k aː n _ tr iːa m _ kl ᴐː3 ŋ d uː d aː w _ s u2 t _ h a j tʰ eː4 k _ m aː _ b ᴐː r i4 k aː n _ h a3 j _ pr a2 cʰ aː cʰ o n _ s ᴐː2 ŋ _ d uː _ d aː w _ fr iː _ t a3 ŋ t ɛː2 _ kʰ ɯː n _ w a n tʰ iː3 _ s i2 p _ p ɛː2 t
อาคารอื้อจือเหลียง,ʔ aː kʰ aː n _ ʔ ɯː3 _ c ɯː _ l iːa5 ŋ
อาทิลูกเกดเมทินีกิ่งโพยมซินดี้เบอร์บริดจ์วรรณษาทองวิเศษอดีตรองมิสไทยแลนด์เวิลด์,ʔ aː tʰ i4 _ l uː3 k k eː2 t _ m eː tʰ i4 n iː _ k i2 ŋ _ pʰ a4 j oː m _ s i n _ d iː3 _ b ɤː _ br i2 t _ w a n _ s aː5 _ tʰ ᴐː ŋ _ w i4 s eː2 t _ ʔ a2 d iː2 t _ r ᴐː ŋ _ m i4 t _ tʰ a j l ɛː _ w ɤː n
การประกวดเริ่มในเวลายี่สิบนาฬิกาห้าสิบนาทีด้วยการเปิดตัวผู้เข้าประกวดทั้งสิบแปดคนในชุดฮิพฮอพ,k aː n _ pr a2 k uːa2 t _ r ɤː3 m _ n a j _ w eː l aː _ j iː3 _ s i2 p _ n aː l i4 k aː _ h aː3 _ s i2 p _ n aː tʰ iː _ d uːa3 j _ k aː n _ p ɤː2 t t uːa _ pʰ uː3 kʰ a3 w pr a2 k uːa2 t _ tʰ a4 ŋ _ s i2 p _ p ɛː2 t _ kʰ o n n a j _ cʰ u4 t _ h i4
แต่ก็ทรงกริ้วเมื่อมีการประท้วงต่อต้านการโจมตีทำไมไม่มีใครออกมาประท้วง,t ɛː2 _ k ᴐː3 _ s o ŋ _ kr i3 w _ m ɯːa3 _ m iː _ k aː n _ pr a2 tʰ uːa4 ŋ _ t ᴐː2 t aː3 n _ k aː n _ c oː m t iː _ tʰ a m m a j _ m a3 j _ m iː _ kʰr a j _ ʔ ᴐː2 k _ m aː _ pr a2 tʰ uːa4 ŋ
ตอนแรกไม่ได้เอะใจเพราะปกติลูกชายจะหายไปประจำอยู่แล้วเฉลี่ยครั้งละสี่ถึงห้าวัน,t ᴐː n r ɛː3 k _ m a3 j d aː3 j _ ʔ e2 c a j _ pʰr ᴐ4 _ p o2 k k a2 t i2 _ l uː3 k cʰ aː j _ c a2 _ h aː5 j _ p a j _ pr a2 c a m _ j uː2 l ɛː4 w _ cʰ a2 l iːa2 _ kʰr a4 ŋ _ l a4 _ s iː2 _ tʰ ɯ5 ŋ _ h aː3 _ w a n
ส่งเสียงกรีดร้องโวยวายตลอดเวลาพร่ำเพ้อถึงแต่พระเชาวลิต,s o2 ŋ s iːa5 ŋ _ kr iː2 t r ᴐː4 ŋ _ w oː j w aː j _ t a2 l ᴐː2 t _ w eː l aː _ pʰr a3 m pʰ ɤː4 _ tʰ ɯ5 ŋ _ t ɛː2 _ pʰr a4 _ cʰ a w _ w a4 l i4 t
ให้เราเป็นคนเลวคนชั่วคนเดียวเถอะความจริงไม่มีใครรู้เมื่อพวกคุณให้มันเลวก็เลวไปเลย,h a3 j _ r a w _ p e n _ kʰ o n l eː w _ kʰ o n _ cʰ uːa3 kʰ o n _ d iːa w _ tʰ ɤ2 _ kʰw aː m c i ŋ _ m a3 j _ m iː _ kʰr a j _ r uː4 _ m ɯːa3 _ pʰ uːa3 k _ kʰ u n _ h a3 j _ m a n _ l eː w _ k ᴐː3 _ l eː w _ p a j _ l ɤː j
อดีตศิษย์โต้คว่ำขันแผ่เมตตา,ʔ a2 d iː2 t _ s i2 t _ t oː3 _ kʰw a3 m _ kʰ a5 n _ pʰ ɛː2 m eː3 t t aː
หวั่นผู้ก่อการร้ายแพร่เชื้อฝีดาษนายริดจ์ยังกล่าวด้วยว่า,w a2 n _ pʰ uː3 k ᴐː2 k aː n r aː4 j _ pʰr ɛː3 cʰ ɯːa4 _ f iː5 d aː2 t _ n aː j _ r i4 t _ j a ŋ _ kl aː2 w _ d uːa3 j _ w aː3
แก้วรอดนักศึกษาชั้นปีที่สี่ประดิษฐ์หุ่นยนต์มัคคุเทศก์เพื่อใช้เป็นสื่อกระตุ้นความสนใจ,k ɛː3 w _ r ᴐː3 t _ n a4 k s ɯ2 k s aː5 _ cʰ a4 n p iː _ tʰ iː3 _ s iː2 _ pr a2 d i2 t _ h u2 n j o n _ m a4 k kʰ u4 tʰ eː3 t _ pʰ ɯːa3 _ cʰ a4 j p e n _ s ɯː2 _ kr a2 t u3 n _ kʰw aː m s o5 n c a j
พาณิชย์จับมือตำรวจล่าพวกเหลือบลิขสิทธิ์แกรมมี่กร้าว,pʰ aː n i4 t _ c a2 p _ m ɯː _ t a m r uːa2 t _ l aː3 _ pʰ uːa3 k _ l ɯːa2 p _ l i4 k tʰ a2 s i2 t _ kr ɛː m _ m iː3 _ kr aː3 w
พร้อมทั้งตีพิมพ์ภาพในแผ่นซีดีรอม,pʰr ᴐː4 m tʰ a4 ŋ _ t iː pʰ i m _ pʰ aː3 p _ n a j _ pʰ ɛː2 n s iː d iː r ᴐː m
ภาพอยู่ในปรู๊ฟและเตรียมจัดพิมพ์แล้วเหมือนกับถูกมัดมือชก,pʰ aː3 p _ j uː2 _ n a j _ pr uː4 p _ l ɛ4 _ tr iːa m _ c a2 t pʰ i m _ l ɛː4 w _ m ɯːa5 n k a2 p _ tʰ uː2 k _ m a4 t _ m ɯː _ cʰ o4 k
กล่าวว่าคำชี้แจงของบริษัทในส่วนที่เกี่ยวกับตนนั้นเป็นข้อความที่บิดเบือน,kl aː2 w _ w aː3 _ kʰ a m cʰ iː4 c ɛː ŋ _ kʰ ᴐː5 ŋ _ b ᴐː r i4 s a2 t _ n a j _ s uːa2 n _ tʰ iː3 _ k iːa2 w k a2 p _ t o n _ n a4 n _ p e n _ kʰ ᴐː3 kʰw aː m _ tʰ iː3 _ b i2 t b ɯːa n
รับรองว่าไม่มีประโยคนี้จากแอฟแน่,r a4 p r ᴐː ŋ _ w aː3 _ m a3 j _ m iː _ pr a2 j oː2 k _ n iː4 _ c aː2 k _ ʔ ɛː2 p _ n ɛː3
หวังใหม่เละฟอกพิเชษฐเมื่อเวลาสิบสามนาฬิกาสามสิบนาที,w a5 ŋ _ m a2 j _ l e4 _ f ᴐː3 k _ pʰ i4 _ cʰ eː3 t _ m ɯːa3 _ w eː l aː _ s i2 p _ s aː5 m _ n aː l i4 k aː _ s aː5 m _ s i2 p _ n aː tʰ iː
แปดนางอุทุมพรฉ่ำผิวตัวแทนบริษัทคันทรีเฟรซเก้านางสาวภัควดีเสนาตัวแทนบริษัทซีพีเมจิ,p ɛː2 t _ n aː ŋ _ ʔ u2 tʰ u m pʰ ᴐː n _ cʰ a2 m _ pʰ i5 w _ t uːa tʰ ɛː n _ b ᴐː r i4 s a2 t _ kʰ a n _ s iː _ fr eː3 t _ k a3 w _ n aː ŋ s aː5 w _ pʰ a4 k _ w a4 d iː _ s eː5 n aː _ t uːa tʰ ɛː n _ b ᴐː r i4 s a2 t _ s iː pʰ iː _ m eː c i2
จึงกระเซอะกระเซิงหนีออกมาขอความช่วยเหลือชาวบ้านในวัดพาไปแจ้งความ,c ɯ ŋ _ kr a2 s ɤ4 kr a2 s ɤː ŋ _ n iː5 _ ʔ ᴐː2 k _ m aː _ kʰ ᴐː5 _ kʰw aː m _ cʰ uːa3 j l ɯːa5 _ cʰ aː w b aː3 n _ n a j _ w a4 t _ pʰ aː _ p a j _ c ɛː3 ŋ kʰw aː m
ไม่ทราบเรื่องที่นางฉวีวรรณขจรประศาสน์มารดาของตัวออกมาระบุเคลื่อนไหวล่ารายชื่อชาวพิจิตร,m a3 j _ s aː3 p _ r ɯːa3 ŋ _ tʰ iː3 _ n aː ŋ _ cʰ a2 w iː5 _ w a n _ kʰ a2 c ᴐː n _ pr a2 s aː2 t _ m aː n d aː _ kʰ ᴐː5 ŋ _ t uːa _ ʔ ᴐː2 k _ m aː _ r a4 b u2 _ kʰl ɯːa3 n w a5 j _ l aː3 _ r aː j cʰ ɯː3 _ cʰ aː w _ pʰ i4 c i2 t
ประพรมน้ำพุทธมนต์เคาะหัวญาติโยมส่วนพลตำรวจเอกสันต์ศรุตานนท์กับคณะเดินทางไปพบกับผู้นำศาสนา,pr a2 pʰr o m _ n aː4 m _ pʰ u4 t _ m o n _ kʰ ᴐ4 _ h uːa5 _ j aː3 t j oː m _ s uːa2 n _ pʰ o n t a m r uːa2 t ʔ eː2 k _ s a5 n _ s a2 r u2 _ t aː _ n o n _ k a2 p _ kʰ a4 n a4 _ d ɤː n tʰ aː ŋ _ p a j _ pʰ o4 p _ k a2 p _ pʰ uː3 n a m _ s aː2 t s a2 n aː5
โดยรายงานจากกรุงเคียฟเมืองหลวงของสาธารณรัฐยูเครนว่า,d oː j _ r aː j ŋ aː n _ c aː2 k _ kr u ŋ _ kʰ iːa3 p _ m ɯːa ŋ l uːa5 ŋ _ kʰ ᴐː5 ŋ _ s aː5 tʰ aː r a4 n a4 r a4 t _ j uː kʰr eː n _ w aː3
ว่าตำรวจยูเครนได้จับกุมผู้ต้องหาชาวยูเครนสี่คน,w aː3 _ t a m r uːa2 t _ j uː kʰr eː n _ d aː3 j _ c a2 p k u m _ pʰ uː3 t ᴐː3 ŋ h aː5 _ cʰ aː w _ j uː kʰr eː n _ s iː2 _ kʰ o n
หญ้าสูงเป็นฟุตขึ้นคลุมสนามฝุ่นจับเขลอะถูกล็อกประตูรั้วและประตูบ้านแน่นหนา,j aː3 _ s uː5 ŋ _ p e n _ f u4 t _ kʰ ɯ3 n _ kʰl u m _ s a2 n aː5 m _ f u2 n c a2 p _ kʰl ɤ2 _ tʰ uː2 k _ l ᴐ4 k _ pr a2 t uː r uːa4 _ l ɛ4 _ pr a2 t uː _ b aː3 n _ n ɛː3 n n aː5
จึงกระโดดมุดลงไปแล้วเอาฝาโอ่งครอบหัวส่วนนายประกอบหาที่หลบไม่ได้วิ่งเตลิดเข้าไปในตลาดนัดพักใหญ่,c ɯ ŋ _ kr a2 d oː2 t _ m u4 t _ l o ŋ _ p a j _ l ɛː4 w _ ʔ a w _ f aː5 _ ʔ oː2 ŋ _ kʰr ᴐː3 p _ h uːa5 _ s uːa2 n _ n aː j _ pr a2 k ᴐː2 p _ h aː5 _ tʰ iː3 _ l o2 p _ m a3 j d aː3 j _ w i3 ŋ _ t a2 l ɤː2 t _ kʰ a3 w _ p a j _ n a j _ t a2 l aː2 t n a4 t _ pʰ a4 k _ j a2 j
โดยเคมีภัณฑ์ต้องห้ามดังกล่าวได้แก่อริสโตโลเซียคลอแรม,d oː j _ kʰ eː m iː pʰ a n _ t ᴐː3 ŋ h aː3 m _ d a ŋ kl aː2 w _ d aː3 j k ɛː2 _ ʔ a2 r i2 t _ t oː _ l oː _ s iːa _ kʰl ᴐː _ r ɛː m
ฟีนิคอลคลอโรฟอร์มคลอโปรมาซีนคอลชิซีนเดปโซนไนโตรฟูแรนส์,f iː _ n i4 _ kʰ ᴐː n _ kʰl ᴐː r oː f ᴐː m _ kʰl ᴐː _ pr oː _ m aː _ s iː n _ kʰ ᴐː n _ cʰ i4 _ s iː _ s oː n _ n a j _ tr oː _ f uː _ r ɛː n
หงส์แดงลิเวอร์พูลชุดประวัติศาสตร์เทรบเบิลแชมป์ในฤดูกาลที่ผ่านมา,h o5 ŋ _ d ɛː ŋ _ l i4 w ɤː pʰ uː n _ cʰ u4 t _ pr a2 w a2 t t i2 s aː2 t _ tʰ eː _ r o4 p _ b ɤː n _ cʰ ɛː m _ n a j _ r ɯ4 d uː k aː n _ tʰ iː3 pʰ aː2 n m aː
เวสเตอร์เฟลด์แดนนีเมอร์ฟีรวมทั้งมิดฟิลด์สุดหล่อเจมีเรดแนพพ์ด้วยขาดเพียงสตีเวนเจอร์ราร์ด,w eː3 t t ɤː3 _ fl eː _ d ɛː n _ n iː _ m ɤː _ f iː _ r uːa m tʰ a4 ŋ _ m i4 t f i n _ s u2 t _ l ᴐː2 _ c eː _ m iː _ r eː _ d a2 n ɛː2 p _ d uːa3 j _ kʰ aː2 t _ pʰ iːa ŋ _ s a2 t iː _ w eː n _ c ɤː3 _ r aː3 t
เพราะแม้ปุ๋ยแห่งชาติจะสั่งฟ้องร้องต่อบริษัทปุ๋ยสากลแล้วก็ตาม,pʰr ᴐ4 _ m ɛː4 _ p u5 j _ h ɛː2 ŋ cʰ aː3 t _ c a2 _ s a2 ŋ _ f ᴐː4 ŋ r ᴐː4 ŋ _ t ᴐː2 _ b ᴐː r i4 s a2 t _ p u5 j _ s aː5 k o n _ l ɛː4 w _ k ᴐː3 t aː m
นายเสนาะตอบว่าเป็นการพูดเพ้อเจ้อพร่ำเพรื่อเรื่องนี้มันไม่ใช่การปราบปรามคอรัปชัน,n aː j _ s a2 n ᴐ2 _ t ᴐː2 p _ w aː3 _ p e n _ k aː n _ pʰ uː3 t _ pʰ ɤː4 c ɤː3 _ pʰr a3 m pʰr ɯːa3 _ r ɯːa3 ŋ _ n iː4 _ m a n _ m a3 j cʰ a3 j _ k aː n _ pr aː2 p pr aː m _ kʰ ᴐː _ r a4 p _ cʰ a n
ท่ามกลางอากาศร้อนอบอ้าวจนนายเฮิร์บเหงื่อออกเต็มใบหน้าโดยปุ๋ยภรณ์ทิพย์ต้องคอยซับเหงื่อให้ว่าที่เจ้าบ่าวอยู่เป็นระยะ,tʰ aː3 m kl aː ŋ _ ʔ aː k aː2 t _ r ᴐː4 n ʔ o2 p ʔ aː3 w _ c o n _ n aː j _ h ɤː3 p _ ŋ ɯːa2 _ ʔ ᴐː2 k _ t e m b a j _ n aː3 _ d oː j _ p u5 j _ pʰ ᴐː n _ tʰ i4 p _ t ᴐː3 ŋ _ kʰ ᴐː j _ s a4 p ŋ ɯːa2 _ h a3 j _ w aː3 tʰ iː3 _ c aː3 w b aː2 w _ j uː2 _ p e n _ r a4 j a4
ด้านขวาแต่ซิลวานายประตูเซเนกัลเหยียดขาสกัดไว้ได้อย่างหวุดหวิดบอลไหลไปเข้าทางแม็กนุสสเวนสัน,d aː3 n kʰw aː5 _ t ɛː2 _ s i n w aː _ n aː j _ pr a2 t uː _ s eː n eː k a n _ j iːa2 t kʰ aː5 _ s a2 k a2 t _ w a4 j _ d aː3 j _ j aː2 ŋ _ w u2 t w i2 t _ b ᴐː n _ l a5 j _ p a j _ kʰ a3 w tʰ aː ŋ _ m ɛ4 k _ n u4 t _ s a2 w eː5 n _ s a5 n
แต่เป็นสวีเดนที่ได้ทักทายก่อนในนาทีที่สี่สิบหกอันเดรียสสเวนสันลากบอลหลบกองหลังเซเนกัลสองคน,t ɛː2 _ p e n _ s a2 w iː5 d eː n _ tʰ iː3 _ d aː3 j _ tʰ a4 k tʰ aː j _ k ᴐː2 n _ n a j _ n aː tʰ iː _ tʰ iː3 _ s iː2 _ s i2 p _ h o2 k _ ʔ a n _ dr iːa2 t _ s a2 w eː5 n _ s a5 n _ l aː3 k _ b ᴐː n _ l o2 p _ k ᴐː ŋ l a5 ŋ _ s eː n eː k a n _ s ᴐː5 ŋ _ kʰ o n
ดาฟกระชากบอลไปถึงเส้นหลังด้านซ้ายแล้วเปิดเข้ากลางประตูเธียววิ่งเข้าตวัดยิงด้วยเท้าขวา,d aː _ f o4 k _ r a4 _ cʰ aː3 k _ b ᴐː n _ p a j _ tʰ ɯ5 ŋ _ s eː3 n _ l a5 ŋ _ d aː3 n s aː4 j _ l ɛː4 w _ p ɤː2 t _ kʰ a3 w _ kl aː ŋ _ pr a2 t uː _ tʰ iːa w _ w i3 ŋ _ kʰ a3 w _ t a2 w a2 t _ j i ŋ _ d uːa3 j _ tʰ aː4 w _ kʰw aː5
สวีเดนเปลี่ยนเอาอันเดรียสแอนเดอร์สันเข้าไปแทนออลแบ็กเซเนกัลเปลี่ยนตัวบ้าง,s a2 w iː5 d eː n _ pl iːa2 n _ ʔ a w _ ʔ a n _ dr iːa _ s a2 ʔ ɛː n _ d ɤː _ s a5 n _ kʰ a3 w _ p a j _ tʰ ɛː n _ ʔ ᴐː _ l a4 b ɛ2 k _ s eː n eː k a n _ pl iːa2 n t uːa _ b aː3 ŋ
ได้ฟรีคิกที่ระยะยี่สิบสองหลาหน้ากรอบเขตโทษเมื่อจาค็อบสันไปกดดิเอิฟจนเสียหลัก,d aː3 j _ fr iː _ kʰ i4 k _ tʰ iː3 _ r a4 j a4 _ j iː3 _ s i2 p _ s ᴐː5 ŋ _ l aː5 _ n aː3 _ kr ᴐː2 p _ kʰ eː2 t tʰ oː3 t _ m ɯːa3 _ c aː _ kʰ ᴐ4 p _ s a5 n _ p a j _ k o2 t _ d i2 _ ʔ ɤː2 p _ c o n _ s iːa5 l a2 k
อย่างไรก็ตามการจัดตีกอล์ฟเคล้านารีที่มุ่งหมายค้ากามอย่างโจ๋งครึ่มในหนนี้กลายเป็นที่ฮือฮาและวิพากษ์วิจารณ์อย่างมาก,j aː2 ŋ r a j k ᴐː3 t aː m _ k aː n _ c a2 t _ t iː _ k ᴐː4 p _ kʰl a4 w _ n aː r iː _ tʰ iː3 _ m u3 ŋ m aː5 j _ kʰ aː4 _ k aː m _ j aː2 ŋ _ c oː5 ŋ kʰr ɯ3 m _ n a j _ h o5 n _ n iː4 _ kl aː j p e n _ tʰ iː3 _ h ɯː h aː _ l ɛ4 _ w i4 pʰ aː3 k w i4 c aː n _ j aː2 ŋ _ m aː3 k
คือภาวะเงินฝืดผมอยากเห็นเงินเฟ้อสูงกว่านี้อยากให้มีเงินเฟ้อบ้างจึงไม่ห่วงเลยว่ามันจะเกิดโอเวอร์ฮีต,kʰ ɯː _ pʰ aː w a4 _ ŋ ɤ n f ɯː2 t _ pʰ o5 m _ j aː2 k _ h e5 n _ ŋ ɤ n f ɤː4 _ s uː5 ŋ _ kw aː2 _ n iː4 _ j aː2 k _ h a3 j _ m iː _ ŋ ɤ n f ɤː4 _ b aː3 ŋ _ c ɯ ŋ _ m a3 j _ h uːa2 ŋ _ l ɤː j _ w aː3 _ m a n _ c a2 _ k ɤː2 t _ ʔ oː w ɤː _ h iː3 t
เพราะมีเหมืองเพชรประมาณห้าเหมืองนอกนั้นก็เป็นเหมืองทองเหมืองแพลทตินัมเหมืองเพชรเหมืองแรก,pʰr ᴐ4 _ m iː _ m ɯːa5 ŋ _ pʰ e4 t _ pr a2 m aː n _ h aː3 _ m ɯːa5 ŋ _ n ᴐː3 k n a4 n _ k ᴐː3 _ p e n _ m ɯːa5 ŋ tʰ ᴐː ŋ _ m ɯːa5 ŋ _ pʰl ɛː3 t _ t i2 _ n a m _ m ɯːa5 ŋ _ pʰ e4 t _ m ɯːa5 ŋ _ r ɛː3 k
นายฟลีสเชอร์ตอบว่าท่านประธานาธิบดีเตรียมให้สาธารณชนรับรู้ถึงความไม่แน่นอนทุกอย่าง,n aː j _ fl iː3 t _ cʰ ɤː _ t ᴐː2 p _ w aː3 _ tʰ a3 n _ pr a2 tʰ aː n aː tʰ i4 b ᴐː d iː _ tr iːa m _ h a3 j _ s aː5 tʰ aː r a4 n a4 cʰ o n _ r a4 p r uː4 _ tʰ ɯ5 ŋ _ kʰw aː m m a3 j n ɛː3 n ᴐː n _ tʰ u4 k _ j aː2 ŋ
และคาดว่าจะปิดไปจนถึงวันจันทร์อย่างไรก็ดีช่วงเวลาสั้นสั้นที่เอ็มไพร์สเตทเปิดให้ประชาชนเข้าออกได้นั้น,l ɛ4 _ kʰ aː3 t _ w aː3 _ c a2 _ p i2 t _ p a j _ c o n _ tʰ ɯ5 ŋ _ w a n c a n _ j aː2 ŋ r a j k ᴐː3 d iː _ cʰ uːa3 ŋ w eː l aː _ s a3 n _ s a3 n _ tʰ iː3 _ ʔ e m _ pʰ a j _ s a2 t eː2 t _ p ɤː2 t _ h a3 j _ pr a2 cʰ aː cʰ o n _ kʰ a3 w ʔ ᴐː2 k _ d aː3 j _ n a4 n
