thai sentence,thai phoneme
ว่าจะเกิดการฆ่าหมู่ครั้งมโหฬารเมื่อพันธมิตรภาคเหนือยึดเมืองกุนดูซได้,w aː3 _ c a2 _ k ɤː2 t _ k aː n _ kʰ aː3 _ m uː2 _ kʰr a4 ŋ _ m a4 h oː5 l aː n _ m ɯːa3 _ pʰ a n tʰ a4 m i4 t _ pʰ aː3 k n ɯːa5 _ j ɯ4 t _ m ɯːa ŋ _ k u2 _ d aː3 j
แต่ก็มีเลือดเปรอะชุ่มไปหมด,t ɛː2 _ k ᴐː3 _ m iː _ l ɯːa3 t _ pr ɤ2 _ cʰ u3 m _ p a j _ m o2 t
พบผู้เสียชีวิตเกลื่อนสี่ศพทราบชื่อนายโบ้วอ้นอินอายุห้าสิบปี,pʰ o4 p _ pʰ uː3 s iːa5 cʰ iː w i4 t _ kl ɯːa2 n _ s iː2 _ s o2 p _ s aː3 p _ cʰ ɯː3 _ n aː j _ b oː3 _ ʔ i n _ ʔ aː j u4 _ h aː3 _ s i2 p _ p iː
ส่งสายตรวจสองคนขึ้นไปเจรจาซึ่งนายสตีเฟนก็เปิดประตูห้องออกมาบอกว่าให้รอเดี๋ยวและปิดประตูห้องตามเดิม,s o2 ŋ _ s aː5 j tr uːa2 t _ s ᴐː5 ŋ _ kʰ o n _ kʰ ɯ3 n _ p a j _ c eː r a4 c aː _ s ɯ3 ŋ _ n aː j _ s a2 t iː f eː n _ k ᴐː3 _ p ɤː2 t _ pr a2 t uː _ h ᴐː3 ŋ _ ʔ ᴐː2 k _ m aː _ b ᴐː2 k _ w aː3 _ h a3 j _ r ᴐː _ d iːa5 w _ l ɛ4 _ p i2 t _ pr a2 t uː _ h ᴐː3 ŋ _ t aː m d ɤː m
วันปล่อยผีกรี๊ดผีจากหลายหลายขุมเตรียมออกอาละวาดกันอีกแล้ว,w a n _ pl ᴐː2 j _ pʰ iː5 _ kr iː4 t _ pʰ iː5 _ c aː2 k _ l aː5 j l aː5 j _ kʰ u5 m _ tr iːa m _ ʔ ᴐː2 k _ ʔ aː l a4 w aː3 t _ k a n _ ʔ iː2 k l ɛː4 w
กลุ่มธุรกิจผลิตแอร์ออกโรงจวกเละแอร์เถื่อนทำพินาศ,kl u2 m _ tʰ u4 r a4 k i2 t _ pʰ a2 l i2 t _ ʔ ɛː _ ʔ ᴐː2 k r oː ŋ _ c uːa2 k _ l e4 _ ʔ ɛː _ tʰ ɯːa2 n _ tʰ a m _ pʰ i4 n aː3 t
อาชีพพ่อค้าส่งเนื้อชำแหละเสร็จมีบาดแผลถูกจ่อยิงด้วยกระสุนปืนขนาดจุดสี่ห้าที่ขมับขวาทะลุซ้ายหนึ่งนัด,ʔ aː cʰ iː3 p _ pʰ ᴐː3 kʰ aː4 _ s o2 ŋ _ n ɯːa4 _ cʰ a m l ɛ2 _ s e2 t _ m iː _ b aː2 t pʰ ɛː5 n _ tʰ uː2 k _ c ᴐː2 _ j i ŋ _ d uːa3 j _ kr a2 s u5 n p ɯː n _ kʰ a2 n aː2 t _ c u2 t _ s iː2 _ h aː3 _ tʰ iː3 _ kʰ a2 m a2 p _ kʰw aː5 _ tʰ a4 l u4 _ s aː4 j _ n ɯ2 ŋ _ n a4 t
สาวไส้แก๊งสวมสิทธิงาบหัวคิว,s aː5 w s a3 j _ k ɛː4 ŋ _ s uːa5 m _ s i2 t tʰ i4 _ ŋ aː3 p _ h uːa5 _ kʰ i w
และถือว่าต่ำกว่าอัตราดอกเบี้ยผ่อนชำระผ่านบัตรเครดิต,l ɛ4 _ tʰ ɯː5 w aː3 _ t a2 m kw aː2 _ ʔ a2 t tr a _ d ᴐː2 k b iːa3 _ pʰ ᴐː2 n cʰ a m r a4 _ pʰ aː2 n _ b a2 t kʰr eː d i2 t
เปิดประตูรั้วเชิญตำรวจเข้าไปในบ้านและพยายามขัดขวางไม่ให้ตรวจค้นบ้าน,p ɤː2 t _ pr a2 t uː r uːa4 _ cʰ ɤː n _ t a m r uːa2 t _ kʰ a3 w _ p a j _ n a j _ b aː3 n _ l ɛ4 _ pʰ a4 j aː j aː m _ kʰ a2 t kʰw aː5 ŋ _ m a3 j _ h a3 j _ tr uːa2 t _ kʰ o4 n _ b aː3 n
แกงเผ็ดเป็ดใส่ผลแอปเปิ้ลทอดมันกุ้งที่ใช้กุ้งแม่น้ำมาโขลกจนเหนียว,k ɛː ŋ pʰ e2 t _ p e2 t _ s a2 j _ pʰ o5 n _ ʔ ɛː2 p p ɤː3 n _ tʰ ᴐː3 t m a n k u3 ŋ _ tʰ iː3 _ cʰ a4 j _ k u3 ŋ _ m ɛː3 n aː4 m _ m aː _ kʰl oː2 k _ c o n _ n iːa5 w
ตำบลเพอำเภอเมืองระยองแล้วลงเล่นน้ำเป็นเหตุให้นายจิตปรีดีเคลือคล้ายอายุสิบเก้าปี,t a m b o n _ pʰ eː _ ʔ a m pʰ ɤː _ m ɯːa ŋ _ r a4 j ᴐː ŋ _ l ɛː4 w _ l o ŋ _ l eː3 n _ n aː4 m _ p e n _ h eː2 t _ h a3 j _ n aː j _ c i2 t _ pr iː d iː _ kʰ eː _ l ɯː _ kʰl aː4 j _ ʔ aː j u4 _ s i2 p _ k a3 w _ p iː
จนทราบว่ามีการอ้างชื่อลงโฆษณาทางเว็บไซต์ดังกล่าวพร้อมให้เบอร์โทรศัพท์ติดต่อเสร็จสรรพ,c o n _ s aː3 p _ w aː3 _ m iː _ k aː n _ ʔ aː3 ŋ _ cʰ ɯː3 _ l o ŋ _ kʰ oː s a2 n aː _ tʰ aː ŋ _ w e4 p s a j _ d a ŋ kl aː2 w _ pʰr ᴐː4 m _ h a3 j _ b ɤː _ tʰ oː r a4 s a2 p _ t i2 t t ᴐː2 _ s e2 t _ s a2 p
จึดรุดไปที่เกิดเหตุซึ่งอยู่ห่างจากถนนเทพารักษ์ประมาณสามร้อยเมตรในเพิงพักร้านขายลาบ,c ɯ2 t _ r u4 t _ p a j _ tʰ iː3 k ɤː2 t h eː2 t _ s ɯ3 ŋ _ j uː2 _ h aː2 ŋ _ c aː2 k _ tʰ a2 n o5 n _ tʰ eː pʰ aː r a4 k _ pr a2 m aː n _ s aː5 m _ r ᴐː4 j _ m eː4 t _ n a j _ pʰ ɤː ŋ _ pʰ a4 k _ r aː4 n _ kʰ aː5 j _ l aː3 p
แต่เชื่อไหมครับคนเฝ้าเผลอแป๊บเดียวพี่ต๊อกหายไปกับสาวอีกแล้ว,t ɛː2 _ cʰ ɯːa3 _ m a5 j _ kʰr a4 p _ kʰ o n _ f a3 w _ pʰl ɤː5 _ p ɛː4 p d iːa w _ pʰ iː3 _ t ᴐː4 k _ h aː5 j _ p a j _ k a2 p _ s aː5 w _ ʔ iː2 k l ɛː4 w
นิรมิตรายงานตัวชูชีพลุยตอบกระทู้ฉุนแลบลิ้นใส่สมาชิกวุฒิสภา,n i4 r a4 m i4 t _ r aː j ŋ aː n t uːa _ cʰ uː cʰ iː3 p _ l u j _ t ᴐː2 p _ kr a2 tʰ uː4 _ cʰ u5 n _ l ɛː3 p l i4 n _ s a2 j _ s a2 m aː cʰ i4 k w u4 tʰ i4 s a2 pʰ aː
รถบรรทุกสิบล้อฮีโน่หมายเลขทะเบียนแปดสิบเอ็ดศูนย์สี่สามหกเพชรบุรี,r o4 t b a n tʰ u4 k s i2 p l ᴐː4 _ h iː _ n oː3 _ m aː5 j l eː3 k _ tʰ a4 b iːa n _ p ɛː2 t _ s i2 p _ ʔ e2 t _ s uː5 n _ s iː2 _ s aː5 m _ h o2 k _ pʰ e4 t cʰ a4 b u2 r iː
เพราะถ้ายังไม่มีความจำเป็นก็จะไม่ขอสินเชื่อจากออมสินให้เสียดอกเบี้ยฟรีฟรี,pʰr ᴐ4 _ tʰ aː3 _ j a ŋ _ m a3 j _ m iː _ kʰw aː m c a m p e n _ k ᴐː3 _ c a2 _ m a3 j _ kʰ ᴐː5 _ s i5 n cʰ ɯːa3 _ c aː2 k _ ʔ ᴐː m s i5 n _ h a3 j _ s iːa5 d ᴐː2 k b iːa3 _ fr iː _ fr iː
เหลือเพียงรอให้การรถไฟทำรั้วกั้นอาณาเขตให้ชัดเจน,l ɯːa5 _ pʰ iːa ŋ _ r ᴐː _ h a3 j k aː n _ r o4 t f a j _ tʰ a m _ r uːa4 _ k a3 n _ ʔ aː n aː kʰ eː2 t _ h a3 j _ cʰ a4 t c eː n
ชัดเจนคาดว่าจะล้อมรั้วเสร็จในเร็วเร็วนี้เดิมพื้นที่แห่งนี้ใช้สำหรับจอดรถทัวร์,cʰ a4 t c eː n _ kʰ aː3 t _ w aː3 _ c a2 _ l ᴐː4 m r uːa4 _ s e2 t _ n a j _ r e w _ r e w _ n iː4 _ d ɤː m _ pʰ ɯː4 n tʰ iː3 _ h ɛː2 ŋ _ n iː4 _ cʰ a4 j _ s a5 m r a2 p _ c ᴐː2 t r o4 t _ tʰ uːa
นายจองชัยตอบว่าไม่ลำบากใจไม่ได้พูดก้าวกร้าวใคร,n aː j _ c ᴐː ŋ _ cʰ a j _ t ᴐː2 p _ w aː3 _ m a3 j _ l a m b aː2 k c a j _ m a3 j d aː3 j _ pʰ uː3 t _ k aː3 w _ kr aː3 w _ kʰr a j
แล้วเกล้าผมม้วนเก็บขึ้นไว้บนศีรษะแค่นี้ก็เสียเซ้ลไปหลายแล้วที่ไม่ได้ปล่อยผมฟูฟ่องวันปกติ,l ɛː4 w _ kl aː3 w pʰ o5 m _ m uːa4 n k e2 p _ kʰ ɯ3 n _ w a4 j _ b o n _ s iː5 s a2 _ kʰ ɛː3 n iː4 _ k ᴐː3 _ s iːa5 _ s eː4 n _ p a j _ l aː5 j _ l ɛː4 w _ tʰ iː3 _ m a3 j d aː3 j _ pl ᴐː2 j _ pʰ o5 m _ f uː f ᴐː3 ŋ _ w a n _ p o2 k k a2 t i2
เอลิซาเบธเฮอร์ลีย์ดาราหนังชื่อดังจนกลายเป็นที่มาของเทรนด์แฟชั่นฮอตฮิตระบาดไปทั่วเกาะอังกฤษในยามนี้,ʔ eː _ l i4 _ s aː _ b eː2 t _ h ɤː _ l iː _ d aː r aː _ n a5 ŋ _ cʰ ɯː3 d a ŋ _ c o n _ kl aː j p e n _ tʰ iː3 m aː _ kʰ ᴐː5 ŋ _ tʰ a4 r eː n _ f ɛː cʰ a3 n _ h ᴐː3 t _ h i4 t _ r a4 b aː2 t _ p a j _ tʰ uːa3 _ k ᴐ2 _ ʔ a ŋ kr i2 t _ n a j _ j aː m _ n iː4
ก็มีอาทิแอนโตนิโอแบนเดราสดาราชื่อดังของฮอลลีวูด,k ᴐː3 _ m iː _ ʔ aː tʰ i4 _ ʔ ɛː n _ t oː _ n i4 ʔ oː _ b ɛː n _ d eː _ r aː _ s a2 d aː _ r aː _ cʰ ɯː3 d a ŋ _ kʰ ᴐː5 ŋ _ h ᴐː n l iː w uː3 t
สมัยเป็นเอกอัครราชทูตประจำสหพันธ์สาธารณรัฐเยอรมนี,s a2 m a5 j _ p e n _ ʔ eː2 k ʔ a2 k kʰr a4 r aː3 t cʰ a4 tʰ uː3 t _ pr a2 c a m _ s a2 h a2 pʰ a n s aː5 tʰ aː r a4 n a4 r a4 t j ɤː r a4 m a4 n iː
มนีนายกษิดภิรมย์เอกอัครราชทูตประจำกระทรวงการต่างประเทศ,m a4 n iː _ n aː j _ k a2 s i2 t _ pʰ i4 r o m _ ʔ eː2 k ʔ a2 k kʰr a4 r aː3 t cʰ a4 tʰ uː3 t _ pr a2 c a m _ kr a2 s uːa ŋ k aː n t aː2 ŋ pr a2 tʰ eː3 t
ซึ่งเป็นเห็ดป่าจากธรรมชาติมาแยกเชื้อบริสุทธิ์และขยายหัวเชื้อเห็ดในเมล็ดข้าวฟ่างที่นึ่งสุกแล้ว,s ɯ3 ŋ _ p e n _ h e2 t _ p aː2 _ c aː2 k _ tʰ a m m a4 cʰ aː3 t _ m aː _ j ɛː3 k _ cʰ ɯːa4 _ b ᴐː r i4 s u2 t _ l ɛ4 _ kʰ a2 j aː5 j _ h uːa5 cʰ ɯːa4 _ h e2 t _ n a j _ m a4 l e4 t _ kʰ aː3 w f aː3 ŋ _ tʰ iː3 _ n ɯ3 ŋ _ s u2 k _ l ɛː4 w
และยังไม่มีการเรียกเอกสารอะไรมาดูเดี๋ยวจะถูกหาว่าเห่อเปล่า,l ɛ4 _ j a ŋ _ m a3 j _ m iː _ k aː n _ r iːa3 k _ ʔ eː2 k k a2 s aː5 n _ ʔ a2 r a j _ m aː _ d uː _ d iːa5 w _ c a2 _ tʰ uː2 k _ h aː5 _ w aː3 _ h ɤː2 _ pl a2 w
เก๋งชนโฟร์วีลชาวแบงก์ตายเรียบห้าศพ,k eː5 ŋ _ cʰ o n _ f oː _ w iː n _ cʰ aː w _ b ɛː ŋ _ t aː j _ r iːa3 p _ h aː3 _ s o2 p
ชาวบ้านที่ไปลงคะแนนเข้าไปกินเหล้าฟรีเบียร์ฟรีกันข้างหน่วยเลือกตั้ง,cʰ aː w b aː3 n _ tʰ iː3 _ p a j _ l o ŋ kʰ a4 n ɛː n _ kʰ a3 w _ p a j _ k i n _ l a3 w _ fr iː _ b iːa _ fr iː _ k a n _ kʰ aː3 ŋ _ n uːa2 j _ l ɯːa3 k t a3 ŋ
เพราะเพลงมาร์ชตำรวจเป็นเพลงมาร์ชที่สมบูรณ์แบบที่สุด,pʰr ᴐ4 _ pʰl eː ŋ _ m aː3 t _ t a m r uːa2 t _ p e n _ pʰl eː ŋ _ m aː3 t _ tʰ iː3 _ s o5 m b uː b ɛː2 p _ tʰ iː3 s u2 t
ขณะที่กำลังมีการตัดเค้กผู้สื่อข่าวคนนี้ได้ถ่ายรูปเมื่อแสงแฟลชสว่างวาบขึ้น,kʰ a2 n a2 tʰ iː3 _ k a m l a ŋ _ m iː _ k aː n _ t a2 t _ kʰ eː4 k _ pʰ uː3 s ɯː2 kʰ aː2 w _ kʰ o n _ n iː4 _ d aː3 j _ tʰ aː2 j r uː3 p _ m ɯːa3 _ s ɛː5 ŋ _ fl ɛː3 t _ s a2 w aː2 ŋ _ w aː3 p _ kʰ ɯ3 n
ต่อมาเจ้าหน้าที่ได้เอาท่อพลาสติกมาหุ้มสายไฟฟ้าให้ทำให้ตอนนี้ฝูงลิงแสมปลอดภัยจาก,t ᴐː2 m aː _ c aː3 w n aː3 tʰ iː3 _ d aː3 j _ ʔ a w _ tʰ ᴐː3 _ pʰ a4 l aː s a2 t i2 k _ m aː _ h u3 m _ s aː5 j f a j f aː4 _ h a3 j _ tʰ a m h a3 j _ t ᴐː n n iː4 _ f uː5 ŋ _ l i ŋ s a2 m ɛː5 _ pl ᴐː2 t pʰ a j _ c aː2 k
เมื่อตนเสียการพนันแทบหมดตัวประกอบกับนางเมกูมิโกะตั้งครรภ์จึงพากลับมาอยู่ด้วยกัน,m ɯːa3 _ t o n _ s iːa5 k aː n _ pʰ a4 n a n _ tʰ ɛː3 p _ m o2 t _ t uːa pr a2 k ᴐː2 p _ k a2 p _ n aː ŋ _ m eː _ k uː _ m i4 _ k o2 _ t a3 ŋ kʰ a n _ c ɯ ŋ _ pʰ aː _ kl a2 p _ m aː _ j uː2 _ d uːa3 j k a n
จนกระทั่งนางเมกูมิโกะคลอดบุตรสาวออกมาคือเมจิอโณมาพออายุได้สองขวบ,c o n kr a2 tʰ a3 ŋ _ n aː ŋ _ m eː _ k uː _ m i4 _ k o2 _ kʰl ᴐː3 t b u2 t _ s aː5 w _ ʔ ᴐː2 k _ m aː _ kʰ ɯː _ m eː c i2 _ ʔ a2 n oː _ m aː _ pʰ ᴐː _ ʔ aː j u4 _ d aː3 j _ s ᴐː5 ŋ _ kʰ uːa2 p
ชวนฉุนลูกพรรคเอื่อยเฉื่อยผู้สื่อข่าวรายงานว่า,cʰ uːa n _ cʰ u5 n _ l uː3 k pʰ a4 k _ ʔ ɯːa2 j _ cʰ ɯːa2 j _ pʰ uː3 s ɯː2 kʰ aː2 w _ r aː j ŋ aː n _ w aː3
ว่าเป็นการจงใจเปิดเผยเรือนร่างยั่วยวนเจ้าของร้านรอจังหวะเจ้าของร้านเผลอ,w aː3 _ p e n _ k aː n _ c o ŋ c a j _ p ɤː2 t pʰ ɤː5 j _ r ɯːa n r aː3 ŋ _ j uːa3 j uːa n _ c aː3 w kʰ ᴐː5 ŋ r aː4 n _ r ᴐː _ c a ŋ w a2 _ c aː3 w kʰ ᴐː5 ŋ r aː4 n _ pʰl ɤː5
การแข่งขันฟุตบอลโลกที่ลุ้นและประทับใจมากคือคู่ฝรั่งเศสกับเซเนกัลเพราะฝรั่งเศสเป็น,k aː n _ kʰ ɛː2 ŋ kʰ a5 n _ f u4 t b ᴐː n _ l oː3 k _ tʰ iː3 _ l u4 n _ l ɛ4 _ pr a2 tʰ a4 p c a j _ m aː3 k _ kʰ ɯː _ kʰ uː3 _ f a2 r a2 ŋ s eː2 t _ k a2 p _ s eː n eː k a n _ pʰr ᴐ4 _ f a2 r a2 ŋ s eː2 t _ p e n
ยูโรสองพันและฟุตบอลโลกหนึ่งพันเก้าร้อยเก้าสิบแปดหรือฟรองซ์เก้าสิบแปดต่างก็ขอร่วม,j uː r oː _ s ᴐː5 ŋ _ pʰ a n _ l ɛ4 _ f u4 t b ᴐː n _ l oː3 k _ n ɯ2 ŋ _ pʰ a n _ k a3 w _ r ᴐː4 j _ k a3 w _ s i2 p _ p ɛː2 t _ r ɯː5 _ fr ᴐː ŋ _ k a3 w _ s i2 p _ p ɛː2 t _ t aː2 ŋ _ k ᴐː3 _ kʰ ᴐː5 _ r uːa3 m
เซลเซียสปรีชาเจ็ดถนนพุทธมณฑลสายสี่หมู่บ้านปรีชาตำบลกระทุ่มล้มอำเภอสามพรานจังหวัดนครปฐม,s eː l s iːa3 t _ pr iː cʰ aː _ c e2 t _ tʰ a2 n o5 n _ pʰ u4 t tʰ a4 m o n tʰ o n _ s aː5 j _ s iː2 _ m uː2 b aː3 n _ pr iː cʰ aː _ t a m b o n _ kr a2 tʰ u3 m _ l o4 m _ ʔ a m pʰ ɤː _ s aː5 m _ pʰr aː n _ c a ŋ w a2 t _ n a4 kʰ ᴐː n p a2 tʰ o5 m
แก่ผู้พบเห็นแต่สัญชาตญาณของเจ้าป่าเหล่านั้นกลับไม่เหลือเค้าความน่าสะพรึงกลัวแม้แต่น้อย,k ɛː2 _ pʰ uː3 _ pʰ o4 p _ h e5 n _ t ɛː2 _ s a5 n cʰ aː3 t t a2 j aː n _ kʰ ᴐː5 ŋ _ c aː3 w _ p aː2 _ l a2 w n a4 n _ kl a2 p _ m a3 j _ l ɯːa5 _ kʰ a4 w _ kʰw aː m _ n aː3 s a2 pʰr ɯ ŋ kl uːa _ m ɛː4 t ɛː2 n ᴐː4 j
ให้เขาช่วยลูกเขาเถอะผมยืนยันที่จะเอาลูกกลับบ้านผมเบื่อแล้ว,h a3 j _ kʰ a5 w _ cʰ uːa3 j _ l uː3 k _ kʰ a5 w _ tʰ ɤ2 _ pʰ o5 m _ j ɯː n j a n _ tʰ iː3 _ c a2 _ ʔ a w _ l uː3 k _ kl a2 p b aː3 n _ pʰ o5 m _ b ɯːa2 _ l ɛː4 w
อุณหภูมิประมาณสามสิบหกถึงสามสิบเจ็ดองศาเซลเซียสคนบ้านหินกรูดลุกฮือบุกยึดที่สาธารณะ,ʔ u n h a2 pʰ uː m _ pr a2 m aː n _ s aː5 m _ s i2 p _ h o2 k _ tʰ ɯ5 ŋ _ s aː5 m _ s i2 p _ c e2 t _ ʔ o ŋ s aː5 s eː l s iːa3 t _ kʰ o n _ b aː3 n _ h i5 n _ kr uː2 t _ l u4 k h ɯː _ b u2 k _ j ɯ4 t _ tʰ iː3 _ s aː5 tʰ aː r a4 n a4
แล้วปลูกต้นชัยพฤกษ์เป็นที่ระลึกพร้อมเปิดแพรคลุมป้ายสำนักงาน,l ɛː4 w _ pl uː2 k _ t o3 n _ cʰ a j j a4 pʰr ɯ4 k _ p e n _ tʰ iː3 r a4 l ɯ4 k _ pʰr ᴐː4 m _ p ɤː2 t _ pʰr ɛː _ kʰl u m _ p aː3 j _ s a5 m n a4 k ŋ aː n
คอมมูนิตี้เชิร์ชในนครลอสแอนเจลิสรัฐแคลิฟอร์เนีย,kʰ ᴐː m _ m uː _ n i4 _ t iː3 _ cʰ ɤː3 t _ n a j _ n a4 kʰ ᴐː n _ l ᴐː3 t _ ʔ ɛː n _ c eː _ l i4 t _ r a4 t _ kʰ ɛː l i4 f ᴐː n iːa
เพราะมีวิธีการหาเหยื่อใกล้เคียงกันมาก,pʰr ᴐ4 _ m iː _ w i4 tʰ iː k aː n _ h aː5 _ j ɯːa2 _ kl a3 j kʰ iːa ŋ _ k a n _ m aː3 k
เป็นการกระทำที่ผิดกฏหมายแน่เบรกไฟฟ้ามั่วนิ่มปรับค่าไฟ,p e n _ k aː n _ kr a2 tʰ a m _ tʰ iː3 _ pʰ i2 t _ k o2 t m aː5 j _ n ɛː3 _ br eː2 k _ f a j f aː4 _ m uːa3 n i3 m _ pr a2 p _ kʰ aː3 _ f a j
สมาชิกสภาผู้แทนราษฎรโผล่ชี้ปมเหตุโยงยุบสองหน่วยรัฐ,s a2 m aː cʰ i4 k s a2 pʰ aː pʰ uː3 tʰ ɛː n r aː3 t s a2 d ᴐː n _ pʰl oː2 _ cʰ iː4 _ p o m _ h eː2 t _ j oː ŋ _ j u4 p _ s ᴐː5 ŋ _ n uːa2 j _ r a4 t
แต่ละศพร่างแหลกเละขาดสองสามท่อนอย่างน่าสยดสยอง,t ɛː2 l a4 _ s o2 p _ r aː3 ŋ _ l ɛː2 k _ l e4 _ kʰ aː2 t _ s ᴐː5 ŋ _ s aː5 m _ tʰ ᴐː3 n _ j aː2 ŋ _ n aː3 s a2 j o2 t s a2 j ᴐː5 ŋ
เซ็นทรัลพลาซ่าลาดพร้าวเมื่อวันที่ยี่สิบสาม,s e n s a n _ pʰ a4 l aː s aː3 _ l aː3 t pʰr aː4 w _ m ɯːa3 _ w a n tʰ iː3 _ j iː3 _ s i2 p _ s aː5 m
นายเชษฐ์ทวี,n aː j _ cʰ eː3 t _ tʰ a4 w iː
ได้แก่ปู๊นปู๊นทางช่องเจ็ดสีรายการสำหรับสตรีดีเด่น,d aː3 j k ɛː2 _ p uː4 _ n a4 p uː4 n _ tʰ aː ŋ _ cʰ ᴐː3 ŋ _ c e2 t _ s iː5 _ r aː j k aː n _ s a5 m r a2 p _ s a2 tr iː _ d iː d eː2 n
คนที่มีความรับผิดชอบสูงเกินตัวเข้มแข็งเด็ดเดี่ยวสนุกที่ได้ลองเล่นอะไรที่ไม่เคยเล่นปกติ,kʰ o n _ tʰ iː3 _ m iː _ kʰw aː m r a4 p pʰ i2 t cʰ ᴐː3 p _ s uː5 ŋ _ k ɤː n t uːa _ kʰ eː3 m kʰ ɛ5 ŋ _ d e2 t d iːa2 w _ s a2 n u2 k _ tʰ iː3 _ d aː3 j _ l ᴐː ŋ _ l eː3 n _ ʔ a2 r a j _ tʰ iː3 _ m a3 j _ kʰ ɤː j _ l eː3 n _ p o2 k k a2 t i2
ปกติตนจะเล่นละครกุ๊กกิ๊กส่วนใหญ่ได้เปลี่ยนมาเล่นแบบนี้เลยสนุกที่ได้ลองอะไรใหม่ใหม่,p o2 k k a2 t i2 _ t o n _ c a2 _ l eː3 n l a4 kʰ ᴐː n _ k u4 k k i4 k _ s uːa2 n j a2 j _ d aː3 j _ pl iːa2 n _ m aː _ l eː3 n _ b ɛː2 p _ n iː4 _ l ɤː j _ s a2 n u2 k _ tʰ iː3 _ d aː3 j _ l ᴐː ŋ _ ʔ a2 r a j _ m a2 j _ m a2 j
ใหม่มีบุกป่าแบกปืนแต่งตัวเท่เท่ค่อนข้างห้าวแบบผู้ชาย,m a2 j _ m iː _ b u2 k _ p aː2 _ b ɛː2 k _ p ɯː n _ t ɛː2 ŋ t uːa _ tʰ eː3 _ tʰ eː3 _ kʰ ᴐː3 n kʰ aː3 ŋ _ h aː3 w _ b ɛː2 p _ pʰ uː3 cʰ aː j
ผู้ชายรู้สึกดีที่ได้ทำงานกับที่ใหม่ใหม่แตกต่างไปจากที่เคยทำก็สนุกไปอีกแบบ,pʰ uː3 cʰ aː j _ r uː4 s ɯ2 k _ d iː _ tʰ iː3 _ d aː3 j _ tʰ a m ŋ aː n _ k a2 p _ tʰ iː3 _ m a2 j _ m a2 j _ t ɛː2 k t aː2 ŋ _ p a j _ c aː2 k _ tʰ iː3 _ kʰ ɤː j _ tʰ a m _ k ᴐː3 _ s a2 n u2 k _ p a j _ ʔ iː2 k _ b ɛː2 p
อีกแบบได้รับรางวัลครั้งนี้ป๊อกก็ขอขอบพระคุณคณะกรรมการทุกท่านที่เมตตาป๊อกและแฟนละครทุกคน,ʔ iː2 k _ b ɛː2 p _ d aː3 j r a4 p _ r aː ŋ w a n _ kʰr a4 ŋ n iː4 _ p ᴐː4 k _ k ᴐː3 _ kʰ ᴐː5 _ kʰ ᴐː2 p pʰr a4 kʰ u n _ kʰ a4 n a4 k a m m a4 k aː n _ tʰ u4 k _ tʰ a3 n _ tʰ iː3 _ m eː3 t t aː _ p ᴐː4 k _ l ɛ4 _ f ɛː n _ l a4 kʰ ᴐː n _ tʰ u4 k _ kʰ o n
นายจุติไกรฤกษ์รองโฆษกพรรคประชาธิปัตย์กล่าวว่าเห็นรัฐบาลเตรียมโม้ผลงานหนึ่งปีแล้วฟังดูน่าหัวเราะ,n aː j _ c u2 t i2 _ kr a j _ r ɤː3 k _ r ᴐː ŋ _ kʰ oː s o2 k _ pʰ a4 k _ pr a2 cʰ aː tʰ i4 p a2 t _ kl aː2 w _ w aː3 _ h e5 n _ r a4 t tʰ a2 b aː n _ tr iːa m _ m oː4 _ pʰ o5 n ŋ aː n _ n ɯ2 ŋ _ p iː _ l ɛː4 w _ f a ŋ d uː _ n aː3 h uːa5 r ᴐ4
กลุ่มคนร้ายจึงรู้ตัวรีบกระโดดกลับมาที่รถแล้วต่างใช้ความเร็ววิ่งหลบหนีไปในความมืด,kl u2 m _ kʰ o n r aː4 j _ c ɯ ŋ _ r uː4 t uːa _ r iː3 p _ kr a2 d oː2 t _ kl a2 p _ m aː _ tʰ iː3 _ r o4 t _ l ɛː4 w _ t aː2 ŋ _ cʰ a4 j _ kʰw aː m r e w _ w i3 ŋ _ l o2 p n iː5 _ p a j _ n a j _ kʰw aː m _ m ɯː3 t
จากนั้นเป็นพระราชพิธีทางศาสนาที่วิหารนิวเวอร์เคริร์ก,c aː2 k n a4 n _ p e n _ pʰr a4 r aː3 t cʰ a4 pʰ i4 tʰ iː _ tʰ aː ŋ _ s aː2 t s a2 n aː5 _ tʰ iː3 _ w i4 h aː5 n _ n i w _ w ɤː _ kʰ eː _ r i4
เป็นปกติเพราะลูกอายุแค่หกขวบซึ่งเมื่อบิลลี่กล่าวถึงตอนนี้แอนกล่าวแทรกขึ้นมาว่า,p e n _ p o2 k k a2 t i2 _ pʰr ᴐ4 _ l uː3 k _ ʔ aː j u4 _ kʰ ɛː3 _ h o2 k _ kʰ uːa2 p _ s ɯ3 ŋ _ m ɯːa3 _ b i n _ l iː3 _ kl aː2 w tʰ ɯ5 ŋ _ t ᴐː n n iː4 _ ʔ ɛː n _ kl aː2 w _ s ɛː3 k _ kʰ ɯ3 n _ m aː _ w aː3
ว่าอยากขอร้องสื่อมวลชนให้ลงข่าวให้ซอฟต์เนื่องจากลูกเข้าโรงเรียนแล้วและจะมีคนมาถามลูกว่าแม่กับพ่ออยู่ด้วยกันหรือเปล่า,w aː3 _ j aː2 k _ kʰ ᴐː5 r ᴐː4 ŋ _ s ɯː2 m uːa n cʰ o n _ h a3 j _ l o ŋ kʰ aː2 w _ h a3 j _ s ᴐː3 p _ n ɯːa3 ŋ c aː2 k _ l uː3 k _ kʰ a3 w _ r oː ŋ r iːa n _ l ɛː4 w _ l ɛ4 _ c a2 _ m iː _ kʰ o n _ m aː _ tʰ aː5 m _ l uː3 k _ w aː3 _ m ɛː3 _ k a2 p _ pʰ ᴐː3 _ j uː2 _ d uːa3 j k a n _ r ɯː5 pl a2 w
เปล่าซึ่งเด็กฟังแล้วแม้อาจไม่เข้าใจความหมายแต่ก็รู้สึกได้พร้อมกันนี้แอนกล่าวอีกว่า,pl a2 w _ s ɯ3 ŋ _ d e2 k _ f a ŋ _ l ɛː4 w _ m ɛː4 _ ʔ aː2 t _ m a3 j _ kʰ a3 w c a j _ kʰw aː m m aː5 j _ t ɛː2 _ k ᴐː3 _ r uː4 s ɯ2 k _ d aː3 j _ pʰr ᴐː4 m k a n n iː4 _ ʔ ɛː n _ kl aː2 w _ ʔ iː2 k _ w aː3
ว่าตอนนี้เราต่างคนต่างกลับไปมองดูความรู้สึกตัวเองเมื่อสรุปได้ยังไงแล้วเราค่อยว่ากันอีกทีแต่ตอนนี้คือ,w aː3 _ t ᴐː n n iː4 _ r a w _ t aː2 ŋ _ kʰ o n _ t aː2 ŋ _ kl a2 p _ p a j _ m ᴐː ŋ d uː _ kʰw aː m r uː4 s ɯ2 k _ t uːa ʔ eː ŋ _ m ɯːa3 _ s a2 r u2 p _ d aː3 j _ j a ŋ ŋ a j _ l ɛː4 w _ r a w _ kʰ ᴐː3 j _ w aː3 _ k a n _ ʔ iː2 k _ tʰ iː _ t ɛː2 _ t ᴐː n n iː4 _ kʰ ɯː
ตำบลแม่จั๊วะ,t a m b o n _ m ɛː3 _ c ua4
